mot_cible,contexte_complet,fichier,speaker,chamber,party,year,date
monetary_policy,facilities means federal reserve implements monetary policy stabilize economy considering vital role,M001137.json,Mr. MEEKS,House,D,2005,2005-05-04
monetary_policy,system today undersecretary treasury domestic monetary policy peter fisher said increasing overall,M000087.json,Ms. MALONEY,House,D,2005,2005-05-04
monetary_policy,fdic taxpayers undersecretary treasury domestic monetary policy peter fisher compelling evidence increased,M000087.json,Ms. MALONEY,House,D,2005,2005-05-04
monetary_policy,reserve s management u s monetary policy bill contains hard fought compromise,O000163.json,Mr. OXLEY,House,R,2005,2005-05-24
monetary_policy,attitudes foreign policy fiscal policy monetary policy save changes need isolationists despite,P000583.json,Mr. PAUL,House,R,2005,2005-06-14
monetary_policy,washington inflation unfair seductive tax monetary policy unfortunately challenged proponents low taxes,P000583.json,Mr. PAUL,House,R,2005,2005-06-14
monetary_policy,housing market expounds america s monetary policy 10 year note housing bubble,E000287.json,Mr. EMANUEL,House,D,2005,2005-07-19
monetary_policy,10 m conduct hearing semiannual monetary policy report congress,W000154.json,Mr. WARNER,Senate,R,2005,2005-07-21
monetary_policy,asked losing control potentially future monetary policy country giving essentially sovereignty ability,P000422.json,Mr. POMEROY,House,D,2005,2005-10-19
monetary_policy,doctorates massachusetts institute technology specialized monetary policy course career taught nation s,W000795.json,Mr. WILSON,House,R,2005,2005-10-27
monetary_policy,indirectly oil dependant severely impacted monetary policy effective controlling inflationary effects supply,B000208.json,Mr. BARTLETT,House,R,2005,2005-11-16
monetary_policy,averting related recessionary effects appropriate monetary policy successful lessening inflationary impacts oil,B000208.json,Mr. BARTLETT,House,R,2005,2005-11-16
monetary_policy,chair ranking member domestic international monetary policy subcommittee series hearings earlier year,M000087.json,Ms. MALONEY,House,D,2005,2005-12-14
monetary_policy,fed s jurisdiction narrowly scoped monetary policy asked chairman greenspan monetary policy,B001066.json,Mr. BUNNING,Senate,R,2006,2006-01-31
monetary_policy,monetary policy asked chairman greenspan monetary policy talk sun answering questions asked,B001066.json,Mr. BUNNING,Senate,R,2006,2006-01-31
monetary_policy,talk sun answering questions asked monetary policy happy clear concise answer hopefully,B001066.json,Mr. BUNNING,Senate,R,2006,2006-01-31
monetary_policy,kind chairman respect hopefully talk monetary policy interfere tax fiscal policy matters,B001066.json,Mr. BUNNING,Senate,R,2006,2006-01-31
monetary_policy,s problems fact talked outside monetary policy arena yes chairman greenspan s,B001066.json,Mr. BUNNING,Senate,R,2006,2006-01-31
monetary_policy,protection act major responsibilities fed monetary policy responsibilities finally indicated intend vote,S000064.json,Mr. SARBANES,Senate,D,2006,2006-01-31
monetary_policy,chairman greenspan s leadership steering monetary policy period included difficult waters think,F000439.json,Mr. FRIST,Senate,R,2006,2006-01-31
monetary_policy,trade policy debt consequences construct monetary policy critically important mr bernanke understand,D000432.json,Mr. DORGAN,Senate,D,2006,2006-01-31
monetary_policy,served federal reserve board dealing monetary policy white house dealing fiscal policy,D000432.json,Mr. DORGAN,Senate,D,2006,2006-01-31
monetary_policy,today twin issues fiscal policy monetary policy needs responsibility understand work improve,D000432.json,Mr. DORGAN,Senate,D,2006,2006-01-31
monetary_policy,period time things gone pretty monetary policy fiscal policy colleague maryland talks,D000432.json,Mr. DORGAN,Senate,D,2006,2006-01-31
monetary_policy,economic stabilizers thoughtful approaches dealing monetary policy fiscal policy believe important understand,D000432.json,Mr. DORGAN,Senate,D,2006,2006-01-31
monetary_policy,hope mr bernanke seizing reins monetary policy country chairman federal reserve board,D000432.json,Mr. DORGAN,Senate,D,2006,2006-01-31
monetary_policy,thank service country different views monetary policy know people talk big shoes,D000432.json,Mr. DORGAN,Senate,D,2006,2006-01-31
monetary_policy,uses vast knowledge economy correct monetary policy decisions hope gains trust wall,B001066.json,Mr. BUNNING,Senate,R,2006,2006-01-31
monetary_policy,happen established different benchmarks terms monetary policy dr bernanke nomination stranger senate,S000064.json,Mr. SARBANES,Senate,D,2006,2006-01-31
monetary_policy,variety economic issues articles relating monetary policy inflation targeting microeconomics central banking,B001066.json,Mr. BUNNING,Senate,R,2006,2006-01-31
monetary_policy,independent fed chairman outside pressures monetary policy decisions good country political considerations,B001066.json,Mr. BUNNING,Senate,R,2006,2006-01-31
monetary_policy,nomination erudite smart rare people monetary policy life s work choose second,S000148.json,Mr. SCHUMER,Senate,D,2006,2006-01-31
monetary_policy,chairman greenspan superb job managing monetary policy anybody says starts leg ideologue,S000148.json,Mr. SCHUMER,Senate,D,2006,2006-01-31
monetary_policy,contrary instance follow mechanistic formulaic monetary policy important economy complicated international considerations,S000148.json,Mr. SCHUMER,Senate,D,2006,2006-01-31
monetary_policy,chairman bernanke internationalization economy affects monetary policy said loopbacks happens yen yuan,S000148.json,Mr. SCHUMER,Senate,D,2006,2006-01-31
monetary_policy,glomerates wealth hope speak issues monetary policy don t respected voices partisan,S000148.json,Mr. SCHUMER,Senate,D,2006,2006-01-31
monetary_policy,universities highly regarded scholar banking monetary policy dr bernanke history public service,D000407.json,Mr. DOMENICI,Senate,R,2006,2006-01-31
monetary_policy,committee face questions concerning conduct monetary policy course monetary policy doesn t,S000064.json,Mr. SARBANES,Senate,D,2006,2006-01-31
monetary_policy,concerning conduct monetary policy course monetary policy doesn t exist vacuum plays,S000064.json,Mr. SARBANES,Senate,D,2006,2006-01-31
monetary_policy,congress federal reserve objectives conduct monetary policy act says board governors federal,S000064.json,Mr. SARBANES,Senate,D,2006,2006-01-31
monetary_policy,london school economics monetary theory monetary policy dr bernanke recipient prestigious fellowships,C000286.json,Mr. CHAMBLISS,Senate,R,2006,2006-01-31
monetary_policy,bank federal reserve responsibility conducting monetary policy maintain maximum employment stable prices,S000320.json,Mr. SHELBY,Senate,R,2006,2006-01-31
monetary_policy,idea rigid formula ideology establish monetary policy particular able push limits lowering,S000064.json,Mr. SARBANES,Senate,D,2006,2006-01-31
monetary_policy,aspects hidden 700 plus pages monetary policy disturbed introduction certain new entitlement,B001250.json,Mr. BISHOP,House,R,2006,2006-02-01
monetary_policy,good shape today reason sound monetary policy tax relief timed sized stimulate,C001057.json,Mr. COLEMAN,Senate,R,2006,2006-02-07
monetary_policy,century transition occurred dramatic change monetary policy nature dollar congress created federal,P000583.json,Mr. PAUL,House,R,2006,2006-02-15
monetary_policy,conduct oversight hearing semi annual monetary policy report federal reserve,C000858.json,Mr. CRAIG,Senate,R,2006,2006-02-16
monetary_policy,buy debt going huge influence monetary policy japan november 2005 gone japan,R000573.json,Mr. ROSS,House,D,2006,2006-02-28
monetary_policy,mr speaker rise introduce sunshine monetary policy act requires federal reserve resume,P000583.json,Mr. PAUL,House,R,2006,2006-03-07
monetary_policy,american public fully informed effects monetary policy mr speaker knowledge money supply,P000583.json,Mr. PAUL,House,R,2006,2006-03-07
monetary_policy,people obtain information cosponsoring sunshine monetary policy act,P000583.json,Mr. PAUL,House,R,2006,2006-03-07
monetary_policy,countries able tremendous dramatic influence monetary policy find appalling find reprehensible find,R000573.json,Mr. ROSS,House,D,2006,2006-03-14
monetary_policy,taiwan directly impact national security monetary policy loans united kingdom 223 2,R000573.json,Mr. ROSS,House,D,2006,2006-03-28
monetary_policy,economy growing economy experienced stimulation monetary policy stimulation fiscal policy stimulation history,H000627.json,Mr. HINCHEY,House,D,2006,2006-04-06
monetary_policy,pro growth tax policy good monetary policy contributed superior performance u s,S000097.json,Mr. SAXTON,House,R,2006,2006-04-06
monetary_policy,influence impact control nation s monetary policy happening interest rates,R000573.json,Mr. ROSS,House,D,2006,2006-04-25
monetary_policy,war complain having information address monetary policy late time handle sound money,P000583.json,Mr. PAUL,House,R,2006,2006-04-25
monetary_policy,house financial services domestic international monetary policy trade technology subcommittee honor serve,B001232.json,Ms. BIGGERT,House,R,2006,2006-04-25
monetary_policy,public lack interest poor understanding monetary policy congress expressed essentially concern significant,P000583.json,Mr. PAUL,House,R,2006,2006-04-25
monetary_policy,supports denying important measurement current monetary policy congress financial community american public,P000583.json,Mr. PAUL,House,R,2006,2006-04-25
monetary_policy,means tells need know trends monetary policy total bank credit available gives,P000583.json,Mr. PAUL,House,R,2006,2006-04-25
monetary_policy,economics august 2005 fiscal policy monetary policy important factor helping restart economic,M000404.json,Mr. MCDERMOTT,House,D,2006,2006-05-03
monetary_policy,longer fiscal discipline 1990s allowed monetary policy encouraged investment long term growth,R000122.json,Mr. REED,Senate,D,2006,2006-05-11
monetary_policy,light common analogy describe american monetary policy compares federal reserve s federal,D000388.json,Mr. DODD,Senate,D,2006,2006-05-16
monetary_policy,slightly modified comparison f making monetary policy like driving car said car,D000388.json,Mr. DODD,Senate,D,2006,2006-05-16
monetary_policy,light common analogy describe american monetary policy compares federal reserve s federal,D000388.json,Mr. DODD,Senate,D,2006,2006-05-16
monetary_policy,slightly modified comparison f making monetary policy like driving car said car,D000388.json,Mr. DODD,Senate,D,2006,2006-05-16
monetary_policy,conduct oversight hearing semi annual monetary policy report federal reserve,I000024.json,Mr. INHOFE,Senate,R,2006,2006-07-19
monetary_policy,10 m conduct hearing semiannual monetary policy report congress,I000024.json,Mr. INHOFE,Senate,R,2006,2006-07-19
monetary_policy,board governors federal reserve system monetary policy report congress think read understood,P000591.json,Mr. PRICE,House,R,2006,2006-07-25
monetary_policy,society terms federal government quote monetary policy report deficit federal unified budget,P000591.json,Mr. PRICE,House,R,2006,2006-07-25
monetary_policy,report federal reserve short portions monetary policy economic outlook report says u,P000591.json,Mr. PRICE,House,R,2006,2006-07-25
monetary_policy,pryce chairwoman subcommittee domestic international monetary policy trade technology course ranking member,W000187.json,Ms. WATERS,House,D,2006,2006-07-25
monetary_policy,reserve system group individuals set monetary policy united states look sorts different,P000591.json,Mr. PRICE,House,R,2006,2006-07-25
monetary_policy,brings presents members congress called monetary policy report board governors federal reserve,P000591.json,Mr. PRICE,House,R,2006,2006-07-25
monetary_policy,members house comments statements official monetary policy report federal reserve short portions,P000591.json,Mr. PRICE,House,R,2006,2006-07-25
monetary_policy,words man charge nation s monetary policy likely source deceleration economic growth,D000407.json,Mr. DOMENICI,Senate,R,2006,2006-07-26
monetary_policy,chairwoman pryce subcommittee domestic international monetary policy trade technology working legislation committee,W000187.json,Ms. WATERS,House,D,2006,2006-07-26
monetary_policy,spent entire career studying writing monetary policy economics passion evident question professor,B001066.json,Mr. BUNNING,Senate,R,2006,2006-07-27
monetary_policy,exchange act 1934 title ii monetary policy provisions sec 201 authorization federal,O000163.json,Mr. OXLEY,House,R,2006,2006-09-27
monetary_policy,deposit insurance corporation title ii monetary policy provisions sec 201 authorization federal,O000163.json,Mr. OXLEY,House,R,2006,2006-09-27
monetary_policy,exchange act 1934 title ii monetary policy provisions sec 201 authorization federal,F000439.json,Mr. FRIST,Senate,R,2006,2006-09-29
monetary_policy,deposit insurance corporation title ii monetary policy provisions sec 201 authorization federal,F000439.json,Mr. FRIST,Senate,R,2006,2006-09-29
monetary_policy,company influenced friedman argued goal monetary policy long term stable growth supply,A000109.json,Mr. ALLARD,Senate,R,2006,2006-11-16
monetary_policy,fully accepted successful countries rely monetary policy chief stabilizing tool shining examples,S000822.json,Mr. STEARNS,House,R,2006,2006-12-06
monetary_policy,notable contributions economic theory area monetary policy 1963 work monetary history united,P000583.json,Mr. PAUL,House,R,2006,2006-12-06
monetary_policy,risk premiums low including better monetary policy strong underlying productivity growth better,F000339.json,Mr. FRANK,House,D,2007,2007-01-12
monetary_policy,affairs hold hearings examine semiannual monetary policy report congress sd 106 health,A000362.json,Mr. ALTMIRE,House,D,2007,2007-02-07
monetary_policy,shall order subcommittee domestic international monetary policy trade technology hold hearing commemorative,F000339.json,Mr. FRANK,House,D,2007,2007-02-27
monetary_policy,generally b subcommittee domestic international monetary policy trade technology jurisdiction subcommittee domestic,F000339.json,Mr. FRANK,House,D,2007,2007-02-27
monetary_policy,technology jurisdiction subcommittee domestic international monetary policy trade technology includes financial aid,F000339.json,Mr. FRANK,House,D,2007,2007-02-27
monetary_policy,act 1950 amended iv domestic monetary policy agencies directly indirectly affect domestic,F000339.json,Mr. FRANK,House,D,2007,2007-02-27
monetary_policy,agencies directly indirectly affect domestic monetary policy including effect policy financial actions,F000339.json,Mr. FRANK,House,D,2007,2007-02-27
monetary_policy,caucus b subcommittee domestic international monetary policy trade technology shall comprised 26,F000339.json,Mr. FRANK,House,D,2007,2007-02-27
monetary_policy,fiscal drag tax hikes easy monetary policy goldman sachs experiment assumes wumm,G000386.json,Mr. GRASSLEY,Senate,R,2007,2007-03-01
monetary_policy,curtailing growth prompting aggressive easing monetary policy lower panels exhibit 2 lay,G000386.json,Mr. GRASSLEY,Senate,R,2007,2007-03-01
monetary_policy,tax cuts expire allowed appropriate monetary policy response assume fed follows rule,G000386.json,Mr. GRASSLEY,Senate,R,2007,2007-03-01
monetary_policy,expire allowed appropriate monetary response monetary policy study s authors assumed federal,G000386.json,Mr. GRASSLEY,Senate,R,2007,2007-03-01
monetary_policy,maloney member subcommittee domestic international monetary policy trade technology introducing important national,W000187.json,Ms. WATERS,House,D,2007,2007-03-01
monetary_policy,gutierrez chairman subcommittee domestic international monetary policy trade technology supporting bill let,W000187.json,Ms. WATERS,House,D,2007,2007-03-01
monetary_policy,6 export controls 7 federal monetary policy including federal reserve system 8,D000388.json,Mr. DODD,Senate,D,2007,2007-03-07
monetary_policy,secretary treasury anybody responsible fiscal monetary policy america democrat budget silent putting,H001036.json,Mr. HENSARLING,House,R,2007,2007-03-27
monetary_policy,corporations congress examine united states monetary policy s effects income inequality federal,P000583.json,Mr. PAUL,House,R,2007,2007-04-18
monetary_policy,affairs committee chairman subcommittee domestic monetary policy 1980 mitchell founded minority business,R000053.json,Mr. RANGEL,House,D,2007,2007-06-06
monetary_policy,state powerful special interests influence monetary policy unfortunately supreme court failed protect,P000583.json,Mr. PAUL,House,R,2007,2007-06-15
monetary_policy,power hungry politicians use inflationary monetary policy expand government proper limits primary,P000583.json,Mr. PAUL,House,R,2007,2007-06-15
monetary_policy,vieira nation s expert constitutional monetary policy says free market functions efficiently,P000583.json,Mr. PAUL,House,R,2007,2007-06-15
monetary_policy,policy fact congress constitutional mandate monetary policy permit currency backed stable commodities,P000583.json,Mr. PAUL,House,R,2007,2007-06-15
monetary_policy,erode american standard living inflationary monetary policy fact congress constitutional mandate monetary,P000583.json,Mr. PAUL,House,R,2007,2007-06-15
monetary_policy,constitution congress authority delegate control monetary policy central bank furthermore constitution certainly,P000583.json,Mr. PAUL,House,R,2007,2007-06-15
monetary_policy,certainly stable value fact entire monetary policy predicated government s ability manipulate,P000583.json,Mr. PAUL,House,R,2007,2007-06-15
monetary_policy,american benefits position advantage cycles monetary policy main beneficiaries receive access artificially,P000583.json,Mr. PAUL,House,R,2007,2007-06-15
monetary_policy,exporters longer held hostage erratic monetary policy stabilizing currency americans new incentives,P000583.json,Mr. PAUL,House,R,2007,2007-06-15
monetary_policy,class americans victimized boom bust monetary policy addition americans suffered steadily eroding,P000583.json,Mr. PAUL,House,R,2007,2007-06-15
monetary_policy,people obtain information cosponsoring sunshine monetary policy act,P000583.json,Mr. PAUL,House,R,2007,2007-06-15
monetary_policy,allow congress reassert constitutional authority monetary policy united states constitution grants congress,P000583.json,Mr. PAUL,House,R,2007,2007-06-15
monetary_policy,american public fully informed effects monetary policy madam speaker knowledge money supply,P000583.json,Mr. PAUL,House,R,2007,2007-06-15
monetary_policy,madam speaker rise introduce sunshine monetary policy act requires federal reserve resume,P000583.json,Mr. PAUL,House,R,2007,2007-06-15
monetary_policy,perils federal reserve s loose monetary policy dr sennholz passed away saturday,P000583.json,Mr. PAUL,House,R,2007,2007-06-28
monetary_policy,key role coalition thank colleague monetary policy subcommittee congresswoman pryce ohio worked,M000087.json,Ms. MALONEY,House,D,2007,2007-07-10
monetary_policy,ranking member subcommittee domestic international monetary policy mr speaker chair bipartisan way,F000339.json,Mr. FRANK,House,D,2007,2007-07-10
monetary_policy,affairs hold hearings examine semiannual monetary policy report congress sd 538 2,T000460.json,Mr. THOMPSON,House,D,2007,2007-07-11
monetary_policy,vote committee conduct hearing semiannual monetary policy report congress,C000141.json,Mr. CARDIN,Senate,D,2007,2007-07-19
monetary_policy,mr frank subcommittee domestic international monetary policy trade technology chair exercise strong,G000535.json,Mr. GUTIÉRREZ,House,D,2007,2007-08-03
monetary_policy,trade responsible helping legislation international monetary policy currency manipulation letter chairman ranking,R000577.json,Mr. RYAN,House,D,2007,2007-12-12
monetary_policy,people country nearly century inflationary monetary policy federal reserve u s dollar,P000583.json,Mr. PAUL,House,R,2007,2007-12-13
monetary_policy,october chaired hearing domestic international monetary policy trade technology subcommittee u s,G000535.json,Mr. GUTIÉRREZ,House,D,2007,2007-12-19
monetary_policy,committee s subcommittee domestic international monetary policy held hearing testified bush administration,G000535.json,Mr. GUTIÉRREZ,House,D,2007,2007-12-19
monetary_policy,75 basis points blunt instrument monetary policy try address seen weakness economy,D000432.json,Mr. DORGAN,Senate,D,2008,2008-01-22
monetary_policy,working combined federal reserve s monetary policy develop thoughtful approaches fiscal policy,D000432.json,Mr. DORGAN,Senate,D,2008,2008-01-22
monetary_policy,president work bipartisan fashion come monetary policy fiscal policy help economy needs,C001068.json,Mr. COHEN,House,D,2008,2008-01-23
monetary_policy,federal reserve board took action monetary policy cut key interest rate 75,D000432.json,Mr. DORGAN,Senate,D,2008,2008-01-23
monetary_policy,aggressive moves stimulus package complementary monetary policy point important fundamentally misunderstand wrong,D000432.json,Mr. DORGAN,Senate,D,2008,2008-01-23
monetary_policy,percent interest rate cut expected monetary policy having moved fed earlier week,D000432.json,Mr. DORGAN,Senate,D,2008,2008-01-25
monetary_policy,fiscal policy initiative compliments fed monetary policy solve underlying problems economy deep,D000432.json,Mr. DORGAN,Senate,D,2008,2008-01-28
monetary_policy,addresses fundamental cause economic instability monetary policy inflationary policies federal reserve root,P000583.json,Mr. PAUL,House,R,2008,2008-01-29
monetary_policy,emerged fiscal stimulus needed complement monetary policy needs meet criteria needs timely,S000749.json,Mr. SPRATT,House,D,2008,2008-01-29
monetary_policy,week half federal reserve board monetary policy tools jump start economy thought,D000432.json,Mr. DORGAN,Senate,D,2008,2008-01-30
monetary_policy,package psychological fact federal reserve monetary policy cutting interest rates banks share,N000032.json,Mr. NELSON,Senate,D,2008,2008-01-31
monetary_policy,hope bring turnaround economy certainly monetary policy changed country seeing significant reductions,G000445.json,Mr. GREGG,Senate,R,2008,2008-02-07
monetary_policy,know fiscal policy talking today monetary policy followed recently fed u s,C001071.json,Mr. CORKER,Senate,R,2008,2008-02-07
monetary_policy,order conduct hearing entitled semiannual monetary policy report congress,S000148.json,Mr. SCHUMER,Senate,D,2008,2008-02-28
monetary_policy,failure economic policy failure fiscal monetary policy period recent years fault particular,K000105.json,Mr. KENNEDY,Senate,D,2008,2008-03-12
monetary_policy,federal reserve acted extraordinary way monetary policy trying lower fed funds rate,C000174.json,Mr. CARPER,Senate,D,2008,2008-04-09
monetary_policy,served 2004 2005 domestic international monetary policy subcommittee vice chair pleased work,B001232.json,Ms. BIGGERT,House,R,2008,2008-04-16
monetary_policy,played rules fault failure fiscal monetary policy lost jobs look total number,K000105.json,Mr. KENNEDY,Senate,D,2008,2008-05-01
monetary_policy,mr gutierrez chairman domestic international monetary policy trade technology subcommittee chaired spike,C000243.json,Mr. CASTLE,House,R,2008,2008-05-13
monetary_policy,need strengthen dollar need change monetary policy stop borrowing need oil companies,K000336.json,Mr. KUCINICH,House,D,2008,2008-05-21
monetary_policy,rate cuts continue aggressively use monetary policy try deal recession facing fed,D000388.json,Mr. DODD,Senate,D,2008,2008-06-09
monetary_policy,financial services subcommittee domestic international monetary policy trade technology,F000010.json,Mr. FALEOMAVAEGA,House,D,2008,2008-06-12
monetary_policy,mr gutierrez chairs domestic international monetary policy subcommittee chaired input suggestions mint,C000243.json,Mr. CASTLE,House,R,2008,2008-07-09
monetary_policy,m conduct hearing entitled semiannual monetary policy report congress,D000563.json,Mr. DURBIN,Senate,D,2008,2008-07-15
monetary_policy,home loans doubt colleagues bank monetary policy committee looking issue terms extra,K000009.json,Ms. KAPTUR,House,D,2008,2008-07-15
monetary_policy,going risk losing running room monetary policy corral fan fred proof powerful,H001016.json,Ms. HUTCHISON,Senate,R,2008,2008-07-26
monetary_policy,default way gse conservatorship d monetary policy geeks aig deal reduces unencumbered,D000432.json,Mr. DORGAN,Senate,D,2008,2008-09-17
monetary_policy,storm financial instability problems stem monetary policy federal reserve 1988 1999 fed,H000338.json,Mr. HATCH,Senate,R,2008,2008-09-23
monetary_policy,1999 fed pursued relatively stable monetary policy anticipation problems financial sector s,H000338.json,Mr. HATCH,Senate,R,2008,2008-09-23
monetary_policy,reserve needs rethink definition good monetary policy determine existing policy tools reserve,H000338.json,Mr. HATCH,Senate,R,2008,2008-09-23
monetary_policy,point obvious aggressive excessively easy monetary policy pursuit short term growth self,H000338.json,Mr. HATCH,Senate,R,2008,2008-09-23
monetary_policy,elected representatives defer federal reserve monetary policy public policy matter involving institutes,F000339.json,Mr. FRANK,House,D,2008,2008-09-23
monetary_policy,2005 served subcommittee domestic international monetary policy trade technology currently ranking republican,R000141.json,Mr. REGULA,House,R,2008,2008-09-25
monetary_policy,government comes failure regulation importantly monetary policy long term certainly need update,B001066.json,Mr. BUNNING,Senate,R,2008,2008-09-26
monetary_policy,problem real fuel fire crisis monetary policy federal reserve vocal critic fed,B001066.json,Mr. BUNNING,Senate,R,2008,2008-09-26
monetary_policy,alan greenspan tried micromanage economy monetary policy economy going ups downs foolish,B001066.json,Mr. BUNNING,Senate,R,2008,2008-09-26
