mot_cible,contexte_complet,fichier,speaker,chamber,party,year,date
monetary_policy,weight federal reserve resumed easing monetary policy interest rates near zero fed,L000261.json,Mr. LEVIN,Senate,D,2011,2011-10-12
monetary_policy,additional near term support economy monetary policy able prevent recession additional fiscal,L000261.json,Mr. LEVIN,Senate,D,2011,2011-10-12
monetary_policy,employment s debatable issue given monetary policy quantitative easing time severe economic,F000339.json,Mr. FRANK,House,D,2011,2011-10-14
monetary_policy,select treated equals setting federal monetary policy officials appointed president confirmed senate,F000339.json,Mr. FRANK,House,D,2011,2011-10-14
monetary_policy,want stress people hands leave monetary policy appointed president confirmed senate hardly,F000339.json,Mr. FRANK,House,D,2011,2011-10-14
monetary_policy,easing time severe economic slowdown monetary policy ought eased mr thinks s,F000339.json,Mr. FRANK,House,D,2011,2011-10-14
monetary_policy,independents m system going vote monetary policy going regulate banking system ultimate,F000339.json,Mr. FRANK,House,D,2011,2011-10-14
monetary_policy,legislation pressure china stop unfair monetary policy china s manipulation currency cost,M001169.json,Mr. MURPHY,House,D,2011,2011-10-14
monetary_policy,t allowed talk federal reserve monetary policy restriction speech bill says shouldn,F000339.json,Mr. FRANK,House,D,2011,2011-10-14
monetary_policy,helped alleviate crisis like limits monetary policy contrary predictions costing federal government,F000339.json,Mr. FRANK,House,D,2011,2011-10-14
monetary_policy,people 5 12 votes setting monetary policy believe violates democratic norms think,F000339.json,Mr. FRANK,House,D,2011,2011-10-14
monetary_policy,setting important public policy america monetary policy interest rates come remotely resembling,F000339.json,Mr. FRANK,House,D,2011,2011-10-14
monetary_policy,bank s opposed view voting monetary policy hasn t elected appointed people,F000339.json,Mr. FRANK,House,D,2011,2011-10-14
monetary_policy,wisdom founders reclaim constitutional primacy monetary policy way called need act fed,K000336.json,Mr. KUCINICH,House,D,2011,2011-11-29
monetary_policy,organization federal reserve responsibilities employment monetary policy traditional responsibilities given consumer protection,M001176.json,Mr. MERKLEY,Senate,D,2011,2011-12-07
monetary_policy,reserve key advisers hard work monetary policy deciding interest rates lend major,M001176.json,Mr. MERKLEY,Senate,D,2011,2011-12-07
monetary_policy,thanks successful recovery act expansionary monetary policy unemployment fallen 8 6 percent,C001078.json,Mr. CONNOLLY,House,D,2011,2011-12-13
monetary_policy,affairs hold hearings examine semiannual monetary policy report congress sd 538 budget,W000808.json,Ms. WILSON,House,D,2012,2012-02-27
monetary_policy,conduct committee hearing entitled semiannual monetary policy report congress,L000123.json,Mr. LAUTENBERG,Senate,D,2012,2012-03-01
monetary_policy,effective approaches federal reserve ease monetary policy boost growth like chart unemployment,M000087.json,Ms. MALONEY,House,D,2012,2012-03-28
monetary_policy,effort mr miller chairs international monetary policy trade subcommittee hard work important,H000874.json,Mr. HOYER,House,D,2012,2012-05-09
monetary_policy,sorts reasons mention particular sets monetary policy important economic tool set economic,V000127.json,Mr. VITTER,Senate,R,2012,2012-05-17
monetary_policy,stake let s talk issues monetary policy federal reserve s primary responsibility,V000127.json,Mr. VITTER,Senate,R,2012,2012-05-17
monetary_policy,huge mandates set healthy proper monetary policy united states personally think mandate,V000127.json,Mr. VITTER,Senate,R,2012,2012-05-17
monetary_policy,reserve chairman bernanke economy set monetary policy unprecedented way editorializing factual assessment,V000127.json,Mr. VITTER,Senate,R,2012,2012-05-17
monetary_policy,fine tune micro manage economy monetary policy blunt tool richard fisher dallas,V000127.json,Mr. VITTER,Senate,R,2012,2012-05-17
monetary_policy,said believes federal reserve s monetary policy evidence working federal reserve bank,V000127.json,Mr. VITTER,Senate,R,2012,2012-05-17
monetary_policy,legitimate strong concerns share current monetary policy federal reserve clear statements nominees,V000127.json,Mr. VITTER,Senate,R,2012,2012-05-17
monetary_policy,board governors nominations important nominations monetary policy regulatory authority bailouts dodd frank,V000127.json,Mr. VITTER,Senate,R,2012,2012-05-17
monetary_policy,chairman bernanke s fed s monetary policy history 3 years need debate,V000127.json,Mr. VITTER,Senate,R,2012,2012-05-17
monetary_policy,known harvard economist strong expertise monetary policy financial regulation stints harvard stein,S000148.json,Mr. SCHUMER,Senate,D,2012,2012-05-17
monetary_policy,inside firms banking financial regulation monetary policy currently coeditor quarterly journal economics,S000148.json,Mr. SCHUMER,Senate,D,2012,2012-05-17
monetary_policy,fed presidents country typically far monetary policy federal reserve board act hawkish,C001071.json,Mr. CORKER,Senate,R,2012,2012-05-17
monetary_policy,interest rates near zero effectiveness monetary policy thought limited fiscal stimulus benefit,K000352.json,Mr. KYL,Senate,R,2012,2012-05-22
monetary_policy,business cycle management stimulus needed monetary policy best way spending stimulus strong,K000352.json,Mr. KYL,Senate,R,2012,2012-05-22
monetary_policy,large chairman bernanke apparently warned monetary policy capable offsetting resulting decline economic,H000338.json,Mr. HATCH,Senate,R,2012,2012-05-22
monetary_policy,schwartz considerable impact academics think monetary policy role play sustaining economic health,B000755.json,Mr. BRADY,House,R,2012,2012-07-17
monetary_policy,schwartz considerable impact academics think monetary policy best known coauthoring milton friedman,B000755.json,Mr. BRADY,House,R,2012,2012-07-17
monetary_policy,conduct committee hearing entitled semiannual monetary policy report congress,U000038.json,Mr. UDALL,Senate,D,2012,2012-07-17
monetary_policy,tool couple little ones left monetary policy problem fiscal policy fiscal policy,C000542.json,Mr. COATS,Senate,R,2012,2012-07-18
monetary_policy,s lending financial system minimal monetary policy limited 2008 ve tripled balance,L000571.json,Ms. LUMMIS,House,R,2012,2012-07-24
monetary_policy,trillion loans clearly congress delegated monetary policy fed advocating abolish fed congress,L000571.json,Ms. LUMMIS,House,R,2012,2012-07-24
monetary_policy,fed members congress better understand monetary policy colleague ron paul instrumental getting,L000571.json,Ms. LUMMIS,House,R,2012,2012-07-24
monetary_policy,crisis restrictions remain place examining monetary policy actions quantitative easing assisting failing,L000571.json,Ms. LUMMIS,House,R,2012,2012-07-24
monetary_policy,decision making process critical area monetary policy bill stands provide information proper,M000087.json,Ms. MALONEY,House,D,2012,2012-07-24
monetary_policy,politics polling data path sound monetary policy decisions monetary policy based raw,M000087.json,Ms. MALONEY,House,D,2012,2012-07-24
monetary_policy,path sound monetary policy decisions monetary policy based raw political needs moment,M000087.json,Ms. MALONEY,House,D,2012,2012-07-24
monetary_policy,reserve board bank subject exceptions monetary policy related decisions activities 2009 congress,C001049.json,Mr. CLAY,House,D,2012,2012-07-24
monetary_policy,partnership corporation notwithstanding generally applicable monetary policy related exceptions 2010 dodd frank,C001049.json,Mr. CLAY,House,D,2012,2012-07-24
monetary_policy,specifically prevents congress fully auditing monetary policy actions fed takes impact daily,G000550.json,Mr. GINGREY,House,R,2012,2012-07-24
monetary_policy,federal reserve s internal deliberations monetary policy matters board governors federal reserve,C000984.json,Mr. CUMMINGS,House,D,2012,2012-07-24
monetary_policy,enacted audit statute prevents audit monetary policy government s accountants understandably outraged,A000367.json,Mr. AMASH,House,R,2012,2012-07-24
monetary_policy,gao examinations door politics intrude monetary policy legislation allow opening federal reserve,C000984.json,Mr. CUMMINGS,House,D,2012,2012-07-24
monetary_policy,retained protections board governors internal monetary policy deliberations ensure audit required legislation,C000984.json,Mr. CUMMINGS,House,D,2012,2012-07-24
monetary_policy,aspects bank s activities including monetary policy matters transactions foreign entities h,T000470.json,Mr. TIPTON,House,R,2012,2012-07-24
monetary_policy,currently oversight federal reserve sets monetary policy impacts american citizen holds balance,T000470.json,Mr. TIPTON,House,R,2012,2012-07-24
monetary_policy,s dealings including decision making monetary policy ability fully audit federal reserve,T000470.json,Mr. TIPTON,House,R,2012,2012-07-24
monetary_policy,foreign central banks discussion actions monetary policy transactions direction federal open market,C001076.json,Mr. CHAFFETZ,House,R,2012,2012-07-24
monetary_policy,makes exception says audit decisions monetary policy says members vote interest rate,F000339.json,Mr. FRANK,House,D,2012,2012-07-24
monetary_policy,period s motives people setting monetary policy let address constitution yes true,F000339.json,Mr. FRANK,House,D,2012,2012-07-24
monetary_policy,critical bank s ability fulfill monetary policy responsibilities dodd frank act carefully,C000984.json,Mr. CUMMINGS,House,D,2012,2012-07-24
monetary_policy,time congress manage micromanage details monetary policy needs able conduct oversight fed,I000056.json,Mr. ISSA,House,R,2012,2012-07-24
monetary_policy,value effort remove politics decisions monetary policy congress outsourced responsibility independent federal,Y000031.json,Mr. YOUNG,House,R,2012,2012-07-24
monetary_policy,time come views concerning stance monetary policy reflect fomc s firm commitment,K000336.json,Mr. KUCINICH,House,D,2012,2012-07-24
monetary_policy,independence subjecting decisions interest rates monetary policy gao audit fed like major,H000874.json,Mr. HOYER,House,D,2012,2012-07-24
monetary_policy,bernanke congressional review fed s monetary policy decisions nightmare scenario especially judging,H000874.json,Mr. HOYER,House,D,2012,2012-07-24
monetary_policy,political economic considerations recipe sound monetary policy urge colleagues defeat bill preserve,H000874.json,Mr. HOYER,House,D,2012,2012-07-24
monetary_policy,banks decision making process setting monetary policy fear transparency free society vital,M001150.json,Ms. MILLER,House,R,2012,2012-07-24
monetary_policy,audit fed s responsibility current monetary policy audits fed insufficient fed operations,J000290.json,Ms. JENKINS,House,R,2012,2012-07-24
monetary_policy,fed independence conducting highly technical monetary policy putting taxpayer resources risk need,K000336.json,Mr. KUCINICH,House,D,2012,2012-07-24
monetary_policy,massachusetts june 6 2012 perspectives monetary policy good evening m honored opportunity,K000336.json,Mr. KUCINICH,House,D,2012,2012-07-24
monetary_policy,given headwinds believe highly accommodative monetary policy needed time help economy mend,K000336.json,Mr. KUCINICH,House,D,2012,2012-07-24
monetary_policy,outlook remarks tonight describe perspective monetary policy begin ll highlight current conditions,K000336.json,Mr. KUCINICH,House,D,2012,2012-07-24
monetary_policy,includes instance review fed s monetary policy operations agreements foreign governments central,I000056.json,Mr. ISSA,House,R,2012,2012-07-24
monetary_policy,2008 2009 reversed critical question monetary policy extent numbers reflect shortfall employment,K000336.json,Mr. KUCINICH,House,D,2012,2012-07-24
monetary_policy,inflation expectations declining important success monetary policy past years time fact longer,K000336.json,Mr. KUCINICH,House,D,2012,2012-07-24
monetary_policy,recovery maintaining highly accommodative stance monetary policy conduct policy unconventional tools turning,K000336.json,Mr. KUCINICH,House,D,2012,2012-07-24
monetary_policy,conduct policy unconventional tools turning monetary policy begin discussing fomc s reliance,K000336.json,Mr. KUCINICH,House,D,2012,2012-07-24
monetary_policy,simulations private sector fully understands monetary policy follows particular rule force figure,K000336.json,Mr. KUCINICH,House,D,2012,2012-07-24
monetary_policy,10 shows taylor rule calls monetary policy tighten immediately balanced approach rule,K000336.json,Mr. KUCINICH,House,D,2012,2012-07-24
monetary_policy,funds rate current level longer monetary policy balanced approach rule achieves rapid,K000336.json,Mr. KUCINICH,House,D,2012,2012-07-24
monetary_policy,achieves rapid reduction unemployment rate monetary policy taylor 1993 rule nonetheless keeping,K000336.json,Mr. KUCINICH,House,D,2012,2012-07-24
monetary_policy,zero lower bound placed conventional monetary policy late 2008 second fully account,K000336.json,Mr. KUCINICH,House,D,2012,2012-07-24
monetary_policy,sought explain view highly accommodative monetary policy remain appropriate time come views,K000336.json,Mr. KUCINICH,House,D,2012,2012-07-24
monetary_policy,given individual judgements appropriate path monetary policy included figure central tendency fomc,K000336.json,Mr. KUCINICH,House,D,2012,2012-07-24
monetary_policy,fiscal policy bias greater spending monetary policy influenced politics bias looser credit,R000570.json,Mr. RYAN,House,R,2012,2012-07-25
monetary_policy,found central bank s loose monetary policy played major role current economic,D000533.json,Mr. DUNCAN,House,R,2012,2012-07-25
monetary_policy,register caution opening fed s monetary policy deliberations actions government audit erode,R000570.json,Mr. RYAN,House,R,2012,2012-07-25
monetary_policy,appearance politicians gaining measure influence monetary policy decisions disastrous consequences political independence,R000570.json,Mr. RYAN,House,R,2012,2012-07-25
monetary_policy,federal reserve important institution pursue monetary policy support goals independent political influence,B000574.json,Mr. BLUMENAUER,House,D,2012,2012-07-31
monetary_policy,affecting federal reserve s conduct monetary policy parliamentarian ultimately granted financial services,B000013.json,Mr. BACHUS,House,R,2012,2012-07-31
monetary_policy,use new tool influence decisions monetary policy failure protect central bank s,B000013.json,Mr. BACHUS,House,R,2012,2012-07-31
monetary_policy,danger allowing political considerations guide monetary policy judgments display recent hearing body,B000013.json,Mr. BACHUS,House,R,2012,2012-07-31
monetary_policy,concerns scope gao s audits monetary policy deliberations aired financial services committee,B000013.json,Mr. BACHUS,House,R,2012,2012-07-31
monetary_policy,insight thinking state economy basis monetary policy judgments unheard past fed chairmen,B000013.json,Mr. BACHUS,House,R,2012,2012-07-31
monetary_policy,monetary policy subcommittee tireless advocacy monetary policy issues crusade open transparent federal,B000013.json,Mr. BACHUS,House,R,2012,2012-07-31
monetary_policy,financial services committee s domestic monetary policy subcommittee tireless advocacy monetary policy,B000013.json,Mr. BACHUS,House,R,2012,2012-07-31
monetary_policy,board s deliberations decisions actions monetary policy matters removing limitation imposed gao,B000013.json,Mr. BACHUS,House,R,2012,2012-07-31
monetary_policy,chairman tomorrow going humility needs monetary policy limits job saddened today news,C001071.json,Mr. CORKER,Senate,R,2012,2012-09-12
monetary_policy,economy entirely federal reserve board monetary policy abandoning job congress enact fiscal,N000147.json,Ms. NORTON,House,D,2012,2012-09-19
monetary_policy,stimulus policy mr bernanke s monetary policy expansion ultimately paid fed softened,W000810.json,Mr. WOODALL,House,R,2012,2012-09-20
monetary_policy,sheet interest rate s going monetary policy makes difference decisions today paid,W000810.json,Mr. WOODALL,House,R,2012,2012-09-20
monetary_policy,t think tax policy think monetary policy washington cut budgets s ll,W000810.json,Mr. WOODALL,House,R,2012,2012-09-20
monetary_policy,build rapidly point cost current monetary policy clear like mr obama s,W000810.json,Mr. WOODALL,House,R,2012,2012-09-20
monetary_policy,talk independent federal reserve engages monetary policy days economic stimulation want point,W000810.json,Mr. WOODALL,House,R,2012,2012-09-20
monetary_policy,federal reserve creates exactly impact monetary policy m saying s right wrong,W000810.json,Mr. WOODALL,House,R,2012,2012-09-20
monetary_policy,reserve act clear section 2 monetary policy objectives congress mr speaker charged,W000810.json,Mr. WOODALL,House,R,2012,2012-09-20
monetary_policy,fed policy financial markets economy monetary policy adds climate economic uncertainty status,W000810.json,Mr. WOODALL,House,R,2012,2012-09-20
monetary_policy,body shouldn t s crazy monetary policy achieve effect nary voter said,W000810.json,Mr. WOODALL,House,R,2012,2012-09-20
monetary_policy,misbehavior routine central economic planning monetary policy regulations legislative mandates acceptable policy,P000583.json,Mr. PAUL,House,R,2012,2012-11-14
monetary_policy,justify government mandates related economy monetary policy foreign policy personal liberty purpose,P000583.json,Mr. PAUL,House,R,2012,2012-11-14
monetary_policy,compounding interest time new american monetary policy climb poverty debt reforms outlined,K000336.json,Mr. KUCINICH,House,D,2013,2013-01-01
monetary_policy,actions lost sight proper role monetary policy economy roughly 3 trillion assets,C001071.json,Mr. CORKER,Senate,R,2013,2013-02-04
monetary_policy,abandoning unemployment fact opposite true monetary policy create environment jobs grow thrive,C001071.json,Mr. CORKER,Senate,R,2013,2013-02-04
monetary_policy,begin returning country right place monetary policy senator vitter joining effort objective,C001071.json,Mr. CORKER,Senate,R,2013,2013-02-04
monetary_policy,environment price stability guiding principle monetary policy decisions radical new idea economists,C001071.json,Mr. CORKER,Senate,R,2013,2013-02-04
monetary_policy,separate task appropriate blunt tools monetary policy developed country s central bank,C001071.json,Mr. CORKER,Senate,R,2013,2013-02-04
monetary_policy,impediments economic growth job creation monetary policy banking infrastructure tax policy subcommittee,I000056.json,Mr. ISSA,House,R,2013,2013-02-08
monetary_policy,coins shall order subcommittee domestic monetary policy technology hold hearing commemorative medal,H001036.json,Mr. HENSARLING,House,R,2013,2013-02-15
monetary_policy,relating tax benefits d subcommittee monetary policy trade jurisdiction subcommittee monetary policy,H001036.json,Mr. HENSARLING,House,R,2013,2013-02-15
monetary_policy,monetary policy trade jurisdiction subcommittee monetary policy trade includes financial aid sectors,H001036.json,Mr. HENSARLING,House,R,2013,2013-02-15
monetary_policy,act 1950 amended iv domestic monetary policy agencies directly indirectly affect domestic,H001036.json,Mr. HENSARLING,House,R,2013,2013-02-15
monetary_policy,agencies directly indirectly affect domestic monetary policy including effect policy financial actions,H001036.json,Mr. HENSARLING,House,R,2013,2013-02-15
monetary_policy,elected minority caucus d subcommittee monetary policy trade shall comprised 20 members,H001036.json,Mr. HENSARLING,House,R,2013,2013-02-15
monetary_policy,6 export controls 7 federal monetary policy including federal reserve system 8,J000177.json,Mr. JOHNSON,Senate,D,2013,2013-02-26
monetary_policy,republican libertarian independent want strong monetary policy strong economic policy years left,S000320.json,Mr. SHELBY,Senate,R,2013,2013-03-12
monetary_policy,burden model account beneficial changes monetary policy accompany enactment budget plan lower,R000570.json,Mr. RYAN,House,R,2013,2013-03-20
monetary_policy,economy needs stimulus getting expansionary monetary policy federal reserve fiscal tightening hurting,C001067.json,Ms. CLARKE,House,D,2013,2013-05-09
monetary_policy,issues wages jobs environment internet monetary policy pharmaceuticals financial services people deeply,W000817.json,Ms. WARREN,Senate,D,2013,2013-06-19
monetary_policy,reserve federal reserve carried responsibility monetary policy responsibility consumer protection basement building,M001176.json,Mr. MERKLEY,Senate,D,2013,2013-07-16
monetary_policy,conflict mission obsessed different mission monetary policy need bureau says new predatory,M001176.json,Mr. MERKLEY,Senate,D,2013,2013-07-16
monetary_policy,fundamental economic challenges thought wrong monetary policy fed cripple entire economy deeply,S000320.json,Mr. SHELBY,Senate,R,2013,2013-07-25
monetary_policy,country inflation increase fed tighten monetary policy contain fed tighten monetary policy,S000320.json,Mr. SHELBY,Senate,R,2013,2013-07-25
monetary_policy,10 trillion fiscal policy uncharted monetary policy waters fed s unprecedented measures,S000320.json,Mr. SHELBY,Senate,R,2013,2013-07-25
monetary_policy,striking fed taking big risks monetary policy administration policy helping economy federal,S000320.json,Mr. SHELBY,Senate,R,2013,2013-07-25
monetary_policy,monetary policy contain fed tighten monetary policy risks stalling weak economy deep,S000320.json,Mr. SHELBY,Senate,R,2013,2013-07-25
monetary_policy,monetary policy like talk minutes monetary policy dry complicated important july 17,S000320.json,Mr. SHELBY,Senate,R,2013,2013-07-25
monetary_policy,business investment innovation mind numbing monetary policy like talk minutes monetary policy,S000320.json,Mr. SHELBY,Senate,R,2013,2013-07-25
monetary_policy,preface remarks fiscal tax regulatory monetary policy challenges face country detailed description,S000320.json,Mr. SHELBY,Senate,R,2013,2013-07-25
monetary_policy,reserve s aggressive use nontraditional monetary policy prop markets financial meltdown 2008,S000320.json,Mr. SHELBY,Senate,R,2013,2013-07-25
monetary_policy,today uncertainty regulatory policy uncertainty monetary policy uncertainty foreign policy significantly uncertainty,C001070.json,Mr. CASEY,Senate,D,2013,2013-09-18
monetary_policy,terms existing obligations pursuing inflationary monetary policy adopting austerity program spending cuts,C001056.json,Mr. CORNYN,Senate,R,2013,2013-10-07
monetary_policy,federal reserve sets nation s monetary policy nonessential consider janet yellen s,R000146.json,Mr. REID,Senate,D,2013,2013-12-18
monetary_policy,public servants set nation s monetary policy guard terrorism deliver justice hold,R000146.json,Mr. REID,Senate,D,2013,2013-12-19
monetary_policy,past decades need chair understands monetary policy affects everyday lives americans seeking,J000177.json,Mr. JOHNSON,Senate,D,2013,2013-12-19
monetary_policy,research papers labor market unemployment monetary policy economy expertise areas including understanding,J000177.json,Mr. JOHNSON,Senate,D,2013,2013-12-19
monetary_policy,understands complexities fed policymaking abstract monetary policy ripple effects affect everyday lives,J000177.json,Mr. JOHNSON,Senate,D,2013,2013-12-19
monetary_policy,easing believe extensive experience working monetary policy issues federal reserve seamless transition,F000062.json,Ms. FEINSTEIN,Senate,D,2013,2013-12-20
monetary_policy,conditions region providing counsel direction monetary policy 2010 appointed president confirmed senate,F000062.json,Ms. FEINSTEIN,Senate,D,2013,2013-12-20
monetary_policy,policy research primarily focused unemployment monetary policy international trade perspective vitally important,F000062.json,Ms. FEINSTEIN,Senate,D,2013,2013-12-20
monetary_policy,proper mandate federal reserve conduct monetary policy 21st century sec 3 establishment,C001056.json,Mr. CORNYN,Senate,R,2014,2014-01-06
monetary_policy,rates reasons politicians reticent involved monetary policy worried blamed economy sours monetary,P000603.json,Mr. PAUL,Senate,R,2014,2014-01-06
monetary_policy,markets liquidity pushing deeper unknown monetary policy territory feel journey end nassim,P000603.json,Mr. PAUL,Senate,R,2014,2014-01-06
monetary_policy,subcommittee communications played strong role monetary policy efforts people work despite congress,B000944.json,Mr. BROWN,Senate,D,2014,2014-01-06
monetary_policy,d transparency issues b report monetary policy later june 30 2014 commission,C001056.json,Mr. CORNYN,Senate,R,2014,2014-01-06
monetary_policy,3 recommend course united states monetary policy going forward including legislative mandate,C001056.json,Mr. CORNYN,Senate,R,2014,2014-01-06
monetary_policy,level growth rate e use monetary policy rules f gold standard 3,C001056.json,Mr. CORNYN,Senate,R,2014,2014-01-06
monetary_policy,long term including discretion determining monetary policy operational regime b price level,C001056.json,Mr. CORNYN,Senate,R,2014,2014-01-06
monetary_policy,federal open market committee conduct monetary policy terms achieving maximum sustainable level,C001056.json,Mr. CORNYN,Senate,R,2014,2014-01-06
monetary_policy,shall 1 examine united states monetary policy creation board governors federal reserve,C001056.json,Mr. CORNYN,Senate,R,2014,2014-01-06
monetary_policy,commission sec 4 duties study monetary policy commission shall 1 examine united,C001056.json,Mr. CORNYN,Senate,R,2014,2014-01-06
monetary_policy,1 million minute need compliant monetary policy exactly consequences massive debts corresponding,P000603.json,Mr. PAUL,Senate,R,2014,2014-01-06
monetary_policy,history united states renewed examination monetary policy 13 central examination renewed look,C001056.json,Mr. CORNYN,Senate,R,2014,2014-01-06
monetary_policy,interest rates encourage investment expansionary monetary policy continue perpetuity causing real lasting,G000386.json,Mr. GRASSLEY,Senate,R,2014,2014-01-06
