mot_cible,contexte_complet,fichier,speaker,chamber,party,year,date
monetary_policy,ranking member subcommittee domestic international monetary policy house committee banking financial services,W000187.json,Ms. WATERS,House,D,1999,1999-10-05
monetary_policy,ranking member subcommittee domestic international monetary policy committee banking financial services serve,W000187.json,Ms. WATERS,House,D,1999,1999-10-07
monetary_policy,past chairman subcommittee domestic international monetary policy gentleman delaware mr castle faithful,M000669.json,Mr. METCALF,House,R,1999,1999-10-19
monetary_policy,chairman greenspan s prudential stewardship monetary policy congress disciplined fiscal policy produced,K000078.json,Ms. KELLY,House,R,1999,1999-10-19
monetary_policy,services jurisdiction fed s conduct monetary policy simply unthinkable hold fed precisely,K000078.json,Ms. KELLY,House,R,1999,1999-10-19
monetary_policy,fed precisely regularly accountable conduct monetary policy succeed getting legislation president time,K000078.json,Ms. KELLY,House,R,1999,1999-10-19
monetary_policy,congressional review fed s conduct monetary policy committee s intent require chairman,K000078.json,Ms. KELLY,House,R,1999,1999-10-19
monetary_policy,s semiannual humphrey hawkins reports monetary policy reports fed s reports policy,K000078.json,Ms. KELLY,House,R,1999,1999-10-19
monetary_policy,bachus chairman subcommittee domestic international monetary policy mr bachus asked given permission,S000250.json,Mr. SESSIONS,House,R,1999,1999-11-04
monetary_policy,services work staff work financial monetary policy reasons bill think important facts,B000400.json,Mr. BENTSEN,House,D,1999,1999-11-04
monetary_policy,ranking member subcommittee domestic international monetary policy committee banking financial services spent,W000187.json,Ms. WATERS,House,D,1999,1999-11-04
monetary_policy,prices consumer price inflation keeping monetary policy easy increase asset prices fueled,P000583.json,Mr. PAUL,House,R,1999,1999-11-08
monetary_policy,countries consider economic conditions setting monetary policy supervise banks strongly believe strengthening,R000570.json,Mr. RYAN,House,R,1999,1999-11-19
monetary_policy,world war 1921 depression consequence monetary policy following war stock market speculation,P000583.json,Mr. PAUL,House,R,2000,2000-01-31
monetary_policy,areas policy distance popular whim monetary policy takes takes formulate takes effect,S000148.json,Mr. SCHUMER,Senate,D,2000,2000-02-02
monetary_policy,come profound differences mr greenspan monetary policy issues believe stewardship federal reserve,D000432.json,Mr. DORGAN,Senate,D,2000,2000-02-02
monetary_policy,board american people sense makes monetary policy board governors seats currently vacant,D000432.json,Mr. DORGAN,Senate,D,2000,2000-02-02
monetary_policy,shut door secret decide kind monetary policy want employ want increase interest,D000432.json,Mr. DORGAN,Senate,D,2000,2000-02-02
monetary_policy,implausible fed chairman steers fed monetary policy money center banks think monetary,D000432.json,Mr. DORGAN,Senate,D,2000,2000-02-02
monetary_policy,policy money center banks think monetary policy ought steered direction course relates,D000432.json,Mr. DORGAN,Senate,D,2000,2000-02-02
monetary_policy,deal country simply fundamental differences monetary policy run monetary policy tight fist,D000432.json,Mr. DORGAN,Senate,D,2000,2000-02-02
monetary_policy,fundamental differences monetary policy run monetary policy tight fist believing certain way,D000432.json,Mr. DORGAN,Senate,D,2000,2000-02-02
monetary_policy,homogenized policy provoke debate country monetary policy century ago debate monetary policy,D000432.json,Mr. DORGAN,Senate,D,2000,2000-02-02
monetary_policy,monetary policy century ago debate monetary policy bars barbershops thought healthy years,D000432.json,Mr. DORGAN,Senate,D,2000,2000-02-02
monetary_policy,vote senate carry vote believe monetary policy ought change country believe country,D000432.json,Mr. DORGAN,Senate,D,2000,2000-02-02
monetary_policy,federal reserve board like someday monetary policy represents entire interests country interests,D000432.json,Mr. DORGAN,Senate,D,2000,2000-02-02
monetary_policy,dinosaur little sunlight great disinfectant monetary policy,D000432.json,Mr. DORGAN,Senate,D,2000,2000-02-02
monetary_policy,day operations fed seek interfere monetary policy area kept separate good reason,R000146.json,Mr. REID,Senate,D,2000,2000-02-02
monetary_policy,greenspan s stewardship nation s monetary policy past 13 years wisdom influence,M001054.json,Mr. MOYNIHAN,Senate,D,2000,2000-02-02
monetary_policy,influence extend far mere stewardship monetary policy wednesday confirmation hearing senate committee,M001054.json,Mr. MOYNIHAN,Senate,D,2000,2000-02-02
monetary_policy,biddle second bank united states monetary policy conducted treasury central banker monetary,G000365.json,Mr. GRAMM,Senate,R,2000,2000-02-02
monetary_policy,originally appointed 1987 wise stewardship monetary policy country small contributed best economic,B000611.json,Mr. BOND,Senate,R,2000,2000-02-02
monetary_policy,homes reach american tremendous crisis monetary policy gotten control today monetary policy,B000611.json,Mr. BOND,Senate,R,2000,2000-02-02
monetary_policy,monetary policy gotten control today monetary policy control growth opportunity american citizens,B000611.json,Mr. BOND,Senate,R,2000,2000-02-02
monetary_policy,times changed learning economics learn monetary policy affects country chairman s firm,B000611.json,Mr. BOND,Senate,R,2000,2000-02-02
monetary_policy,subject fed popular whim frankly monetary policy areas policy distance popular whim,S000148.json,Mr. SCHUMER,Senate,D,2000,2000-02-02
monetary_policy,board disagreed chairman greenspan past monetary policy disagree future oriented growth jobs,S000064.json,Mr. SARBANES,Senate,D,2000,2000-02-02
monetary_policy,focused personal criticisms important issues monetary policy affect constituents think arguments raised,W000288.json,Mr. WELLSTONE,Senate,D,2000,2000-02-02
monetary_policy,greenspan nomination comes think debating monetary policy time burner issue alan greenspan,W000288.json,Mr. WELLSTONE,Senate,D,2000,2000-02-02
monetary_policy,president chance discuss interest rates monetary policy body alan greenspan gets renominated,W000288.json,Mr. WELLSTONE,Senate,D,2000,2000-02-02
monetary_policy,community corner state depends extent monetary policy decisions federal reserve board washington,W000288.json,Mr. WELLSTONE,Senate,D,2000,2000-02-02
monetary_policy,federal reserve board washington importance monetary policy grown time labor secretary bob,W000288.json,Mr. WELLSTONE,Senate,D,2000,2000-02-02
monetary_policy,budgets pass legislation consider reason monetary policy fallen political radar screen time,W000288.json,Mr. WELLSTONE,Senate,D,2000,2000-02-02
monetary_policy,debate farmers midwest gold standard monetary policy decades great depression pressing national,W000288.json,Mr. WELLSTONE,Senate,D,2000,2000-02-02
monetary_policy,connected interest rates interest rates monetary policy important instruments u s economic,W000288.json,Mr. WELLSTONE,Senate,D,2000,2000-02-02
monetary_policy,involving broad public participation debate monetary policy time mr greenspan renominated board,W000288.json,Mr. WELLSTONE,Senate,D,2000,2000-02-02
monetary_policy,tight fiscal policy administration congress monetary policy allowed economy grow focused evidence,S000064.json,Mr. SARBANES,Senate,D,2000,2000-02-02
monetary_policy,past years tremendously successful experiment monetary policy hope draw right lessons success,W000288.json,Mr. WELLSTONE,Senate,D,2000,2000-02-02
monetary_policy,important thing realize unexpected experiment monetary policy worked fed s unusual deviation,W000288.json,Mr. WELLSTONE,Senate,D,2000,2000-02-02
monetary_policy,conclusions conclusions draw follows think monetary policy past 4 years pleasant surprise,W000288.json,Mr. WELLSTONE,Senate,D,2000,2000-02-02
monetary_policy,early 1990 s unnecessarily tight monetary policy federal reserve trend didn t,W000288.json,Mr. WELLSTONE,Senate,D,2000,2000-02-02
monetary_policy,extent perplexing irony 1996 debate monetary policy comes greenspan nomination comes think,W000288.json,Mr. WELLSTONE,Senate,D,2000,2000-02-02
monetary_policy,come floor senate important debate monetary policy 1996 think took exception fed,W000288.json,Mr. WELLSTONE,Senate,D,2000,2000-02-02
monetary_policy,unlearning lessons successful recent experiment monetary policy reverting old ways june august,W000288.json,Mr. WELLSTONE,Senate,D,2000,2000-02-02
monetary_policy,alan greenspan s nomination debate monetary policy going debate saying concerned federal,W000288.json,Mr. WELLSTONE,Senate,D,2000,2000-02-02
monetary_policy,country late 1800s tremendous emphasis monetary policy need real interest rates time,W000288.json,Mr. WELLSTONE,Senate,D,2000,2000-02-02
monetary_policy,decent wages critically important looked monetary policy interest rates fact difficult sustain,W000288.json,Mr. WELLSTONE,Senate,D,2000,2000-02-02
monetary_policy,relevant discuss monetary policy debate monetary policy alan greenspan gets renominated federal,W000288.json,Mr. WELLSTONE,Senate,D,2000,2000-02-02
monetary_policy,kind ironic time relevant discuss monetary policy debate monetary policy alan greenspan,W000288.json,Mr. WELLSTONE,Senate,D,2000,2000-02-02
monetary_policy,start reverse 1996 thanks looser monetary policy federal reserve increase minimum wage,W000288.json,Mr. WELLSTONE,Senate,D,2000,2000-02-02
monetary_policy,people s lives people know monetary policy fact look real interest rates,W000288.json,Mr. WELLSTONE,Senate,D,2000,2000-02-02
monetary_policy,greenspan continue providing vital leadership monetary policy common goal keeping economy robust,K000305.json,Mr. KOHL,Senate,D,2000,2000-02-03
monetary_policy,chairman greenspan consistently steered american monetary policy prudent responsible course won respect,K000305.json,Mr. KOHL,Senate,D,2000,2000-02-03
monetary_policy,success chairman greenspan s decisions monetary policy helped lead low unemployment low,H001028.json,Mr. HAGEL,Senate,R,2000,2000-02-03
monetary_policy,advice alan greenspan marriage fiscal monetary policy pay debt ensure fiscal prudence,D000064.json,Mr. DASCHLE,Senate,D,2000,2000-02-03
monetary_policy,leadership chairman greenspan leader creating monetary policy setting tone country difficult choices,D000064.json,Mr. DASCHLE,Senate,D,2000,2000-02-03
monetary_policy,measure marriage fiscal monetary policy monetary policy created leadership chairman greenspan leader,D000064.json,Mr. DASCHLE,Senate,D,2000,2000-02-03
monetary_policy,country large measure marriage fiscal monetary policy monetary policy created leadership chairman,D000064.json,Mr. DASCHLE,Senate,D,2000,2000-02-03
monetary_policy,mr greespan described master art monetary policy certainly learned grown office renomination,D000064.json,Mr. DASCHLE,Senate,D,2000,2000-02-03
monetary_policy,economic success ability coordinate fed monetary policy fiscal policy reasons fact inseparable,D000064.json,Mr. DASCHLE,Senate,D,2000,2000-02-03
monetary_policy,question continued leadership chairman greenspan monetary policy country respect fiscal policy country,C000705.json,Mr. CONRAD,Senate,D,2000,2000-02-03
monetary_policy,spending policy tax policy america monetary policy controlled federal reserve board course,C000705.json,Mr. CONRAD,Senate,D,2000,2000-02-03
monetary_policy,success fiscal policy united states monetary policy united states fiscal policy america,C000705.json,Mr. CONRAD,Senate,D,2000,2000-02-03
monetary_policy,need continuing steady hand helm monetary policy truly new economy continue defy,H000338.json,Mr. HATCH,Senate,R,2000,2000-02-03
monetary_policy,voice steady reason common sense monetary policy policies shown prescience stewardship confident,H000338.json,Mr. HATCH,Senate,R,2000,2000-02-03
monetary_policy,reasons fact inseparable marriage fiscal monetary policy created sustained current economic expansion,D000064.json,Mr. DASCHLE,Senate,D,2000,2000-02-03
monetary_policy,seeing economic achievement country fiscal monetary policy says want build want continue,D000064.json,Mr. DASCHLE,Senate,D,2000,2000-02-08
monetary_policy,federal reserve s semi annual monetary policy report 2000,B001126.json,Mr. BURNS,Senate,R,2000,2000-02-23
monetary_policy,admire public service profoundly disagree monetary policy discover americans know productivity increased,D000432.json,Mr. DORGAN,Senate,D,2000,2000-03-07
monetary_policy,elimination trade barriers inflation fighting monetary policy tax cuts encourage economic growth,C000830.json,Mr. COX,House,R,2000,2000-03-09
monetary_policy,lowering raising interest rates appropriate monetary policy current condition economy inflation signals,F000339.json,Mr. FRANK,House,D,2000,2000-03-16
monetary_policy,little bit longer addition successful monetary policy recently federal reserve strides increased,S000097.json,Mr. SAXTON,House,R,2000,2000-03-23
monetary_policy,slow growth federal spending focus monetary policy price stability result economic program,B000013.json,Mr. BACHUS,House,R,2000,2000-04-03
monetary_policy,friend chairman subcommittee domestic international monetary policy committee banking financial services granting,G000152.json,Mr. GIBBONS,House,R,2000,2000-04-03
monetary_policy,cycle good fiscal policy good monetary policy helped economy grow genius american,C000705.json,Mr. CONRAD,Senate,D,2000,2000-04-04
monetary_policy,lot happen good fiscal responsibility monetary policy stable energy prices right board,L000447.json,Mr. LOTT,Senate,R,2000,2000-04-10
monetary_policy,continue place policies congressional actions monetary policy administration economic growth year year,L000447.json,Mr. LOTT,Senate,R,2000,2000-04-10
monetary_policy,inherent stability banking system implementation monetary policy dictate minimal level reserves appropriate,V000087.json,Mr. VENTO,House,D,2000,2000-04-11
monetary_policy,controlled congress president united states monetary policy controlled federal reserve work hand,C000705.json,Mr. CONRAD,Senate,D,2000,2000-04-13
monetary_policy,deficits important fiscal policy country monetary policy finds reagan administration inherited deficit,C000705.json,Mr. CONRAD,Senate,D,2000,2000-04-13
monetary_policy,stay course alan greenspan charge monetary policy congress president charge fiscal policy,C000705.json,Mr. CONRAD,Senate,D,2000,2000-04-13
monetary_policy,fiscal policy federal reserve charge monetary policy head monetary policy country says,C000705.json,Mr. CONRAD,Senate,D,2000,2000-04-13
monetary_policy,reserve charge monetary policy head monetary policy country says pay debt urging,C000705.json,Mr. CONRAD,Senate,D,2000,2000-04-13
monetary_policy,sterile reserves helpful tool conduct monetary policy understandably industry view combination required,L000556.json,Mr. LAFALCE,House,D,2000,2000-05-11
monetary_policy,ranking member subcommittee domestic international monetary policy subcommittee jurisdiction world bank chief,L000556.json,Mr. LAFALCE,House,D,2000,2000-05-15
monetary_policy,obviously soundness central economic planning monetary policy sort fallacy object deliberately slowing,P000583.json,Mr. PAUL,House,R,2000,2000-05-15
monetary_policy,stand tilt far country deserves monetary policy allows workers factories main streets,D000432.json,Mr. DORGAN,Senate,D,2000,2000-05-15
monetary_policy,tilt money center banks question monetary policy tilt way funny stand tilt,D000432.json,Mr. DORGAN,Senate,D,2000,2000-05-15
monetary_policy,economy slows fiscal policy current monetary policy solve crisis soon face sound,P000583.json,Mr. PAUL,House,R,2000,2000-05-16
monetary_policy,appearing horizon sooner pay attention monetary policy source international financial problems sooner,P000583.json,Mr. PAUL,House,R,2000,2000-05-16
monetary_policy,growth dow nasdaq foreign international monetary policy opportunity mr chairman visit high,F000262.json,Mr. FORD,House,D,2000,2000-06-08
monetary_policy,lee utilized membership domestic international monetary policy subcommittee talk president secretary treasury,S000810.json,Mr. STARK,House,D,2000,2000-06-09
monetary_policy,countries consider economic conditions setting monetary policy supervise banks like conclude repeating,R000570.json,Mr. RYAN,House,R,2000,2000-07-10
monetary_policy,bachus chairman subcommittee domestic international monetary policy committee banking financial services beautiful,P000197.json,Ms. PELOSI,House,D,2000,2000-07-12
monetary_policy,bachus chairman subcommittee domestic international monetary policy committee banking financial services,P000197.json,Ms. PELOSI,House,D,2000,2000-07-12
monetary_policy,frank chair subcommittee domestic international monetary policy committee banking financial services expert,P000197.json,Ms. PELOSI,House,D,2000,2000-07-12
monetary_policy,frank member subcommittee domestic international monetary policy committee banking financial services knowledgeable,P000197.json,Ms. PELOSI,House,D,2000,2000-07-12
monetary_policy,ranking member subcommittee domestic international monetary policy committee banking financial services expert,P000197.json,Ms. PELOSI,House,D,2000,2000-07-12
monetary_policy,ranking member subcommittee domestic international monetary policy champion international debt relief,P000197.json,Ms. PELOSI,House,D,2000,2000-07-12
monetary_policy,ranking member subcommittee domestic international monetary policy house banking committee know important,W000187.json,Ms. WATERS,House,D,2000,2000-07-12
monetary_policy,ranking member subcommittee domestic international monetary policy sent gao said listen report,C000052.json,Mr. CALLAHAN,House,R,2000,2000-07-12
monetary_policy,government intervention economy country s monetary policy degree recipient country allows foreign,F000439.json,Mr. FRIST,Senate,R,2000,2000-07-13
monetary_policy,topic speech tonight federal reserve monetary policy greenspan s fed world s,M000669.json,Mr. METCALF,House,R,2000,2000-07-18
monetary_policy,2015 performing major task administration monetary policy federal reserve system agency congress,M000669.json,Mr. METCALF,House,R,2000,2000-07-18
monetary_policy,discount rate reserve requirements execution monetary policy ongoing basis decided larger 12,M000669.json,Mr. METCALF,House,R,2000,2000-07-18
monetary_policy,run goal price stability reality monetary policy economy exactly greenspan want knows,M000669.json,Mr. METCALF,House,R,2000,2000-07-18
monetary_policy,government spending health education policy monetary policy privatization imf deserves blame poverty,K000336.json,Mr. KUCINICH,House,D,2000,2000-07-19
monetary_policy,program trade liberalization devaluation tight monetary policy dismantling state financing marketing mechanisms,H000874.json,Mr. HOYER,House,D,2000,2000-07-20
monetary_policy,government performing major task administration monetary policy federal reserve system agency congress,M000669.json,Mr. METCALF,House,R,2000,2000-07-24
monetary_policy,range goal price stability reality monetary policy economy exactly greenspan want knows,M000669.json,Mr. METCALF,House,R,2000,2000-07-24
monetary_policy,precisely long term effects fed monetary policy concern congress oversight role precisely,M000669.json,Mr. METCALF,House,R,2000,2000-07-24
monetary_policy,role long term effects fed monetary policy going government certainly congress question,M000669.json,Mr. METCALF,House,R,2000,2000-07-24
monetary_policy,discount rate reserve requirements execution monetary policy ongoing basis decided larger 12,M000669.json,Mr. METCALF,House,R,2000,2000-07-24
monetary_policy,good mischief immense power national monetary policy,M000669.json,Mr. METCALF,House,R,2000,2000-07-24
monetary_policy,remark indicated chosen wages indicator monetary policy case economists form discourse greenspanish,M000669.json,Mr. METCALF,House,R,2000,2000-09-07
monetary_policy,policy country provide foundation sensible monetary policy continued expansion economy economic benefits,R000122.json,Mr. REED,Senate,D,2000,2000-09-13
monetary_policy,seldom quote alan greenspan disagreements monetary policy break rule today came congress,D000432.json,Mr. DORGAN,Senate,D,2000,2000-09-15
monetary_policy,members subcommittee worked diligently subcommittee monetary policy remains strong sound changing global,P000444.json,Mr. PORTER,House,R,2000,2000-09-18
monetary_policy,distinguished chairman subcommittee domestic international monetary policy gentleman alabama mr bachus member,P000444.json,Mr. PORTER,House,R,2000,2000-09-18
monetary_policy,committee banking financial services subcommittee monetary policy active member assure continue work,B000013.json,Mr. BACHUS,House,R,2000,2000-09-18
monetary_policy,leadership chairman subcommittee domestic international monetary policy provides jurisdiction kind legislation mr,F000010.json,Mr. FALEOMAVAEGA,House,D,2000,2000-09-18
monetary_policy,financial services subcommittee domestic international monetary policy approved unanimously strongly feel action,B000013.json,Mr. BACHUS,House,R,2000,2000-09-18
monetary_policy,aisle interest shown issue concern monetary policy today house takes h r,W000187.json,Ms. WATERS,House,D,2000,2000-09-18
monetary_policy,castle chairman subcommittee domestic international monetary policy reforms commemorative coin program reforms,B000013.json,Mr. BACHUS,House,R,2000,2000-09-19
monetary_policy,economic policy issues far purview monetary policy letter begins chairman greenspan believe,M001085.json,Mr. MURKOWSKI,Senate,R,2000,2000-09-21
monetary_policy,economic policy issues far purview monetary policy letter begins chairman greenspan believe,M001085.json,Mr. MURKOWSKI,Senate,R,2000,2000-09-21
monetary_policy,spend reagan initiated sea change monetary policy want federal reserve manipulate money,M000019.json,Mr. MACK,Senate,R,2000,2000-10-05
monetary_policy,angell shared view took politics monetary policy reagan years loudest strongest advocate,M000019.json,Mr. MACK,Senate,R,2000,2000-10-05
monetary_policy,banking committee attempted institutionalize approach monetary policy sponsoring bill price stability economic,M000019.json,Mr. MACK,Senate,R,2000,2000-10-05
monetary_policy,stabilization goal federal reserve thanks monetary policy initiated president reagan legislation safeguard,M000019.json,Mr. MACK,Senate,R,2000,2000-10-05
monetary_policy,inflation interest rates politicized use monetary policy manipulate consumer demand trend 2,M000019.json,Mr. MACK,Senate,R,2000,2000-10-05
monetary_policy,constitutional responsibility maintain sound dollar monetary policy 10 years produced largest financial,P000583.json,Mr. PAUL,House,R,2000,2000-10-11
monetary_policy,grant authority central bank designs monetary policy complete secrecy inflating currency stealing,P000583.json,Mr. PAUL,House,R,2000,2000-10-11
monetary_policy,legislation totally ignoring important issue monetary policy congress certainly reneged responsibility area,P000583.json,Mr. PAUL,House,R,2000,2000-10-11
monetary_policy,ranking member subcommittee domestic international monetary policy committee banking financial services passionate,K000009.json,Ms. KAPTUR,House,D,2000,2000-10-11
monetary_policy,trying sound warning foreign policy monetary policy today monetary policy foreign policy,P000583.json,Mr. PAUL,House,R,2000,2000-10-12
monetary_policy,foreign policy monetary policy today monetary policy foreign policy clashed face problems,P000583.json,Mr. PAUL,House,R,2000,2000-10-12
monetary_policy,good economists recognize inflation consequence monetary policy increases supply money inflates currency,P000583.json,Mr. PAUL,House,R,2000,2000-10-12
monetary_policy,efficiency act 2000 subtitle improving monetary policy financial institution management practices sec,L000169.json,Mr. LEACH,House,R,2000,2000-10-24
monetary_policy,house representatives containing discussion conduct monetary policy economic developments prospects future taking,L000169.json,Mr. LEACH,House,R,2000,2000-10-24
monetary_policy,open market committee respect conduct monetary policy b economic developments prospects future,L000169.json,Mr. LEACH,House,R,2000,2000-10-24
monetary_policy,congress federal reserve board conduct monetary policy reports renewed deemed important oversight,L000169.json,Mr. LEACH,House,R,2000,2000-10-24
monetary_policy,congress review fed s conducted monetary policy regard federal reserve system section,L000169.json,Mr. LEACH,House,R,2000,2000-10-24
monetary_policy,1200 short title subtitle improving monetary policy financial institution management practices sec,L000169.json,Mr. LEACH,House,R,2000,2000-10-24
monetary_policy,congress semi annual hearings discuss monetary policy economic developments prospects future chairman,L000169.json,Mr. LEACH,House,R,2000,2000-10-25
monetary_policy,burden government government intervention economy monetary policy capital flow foreign investment banking,S000106.json,Mr. SCARBOROUGH,House,R,2000,2000-10-25
monetary_policy,trade commerce law enforcement finance monetary policy aviation shipping communications tourism cultural,G000212.json,Mr. GILMAN,House,R,2000,2000-10-26
monetary_policy,reduce regulations totally apathetic dollar monetary policy congress moral constitutional obligation protect,P000583.json,Mr. PAUL,House,R,2000,2000-11-13
monetary_policy,1200 short title subtitle improving monetary policy financial institution management practices sec,A000109.json,Mr. ALLARD,Senate,R,2000,2000-12-05
monetary_policy,congress semi annual hearings discuss monetary policy economic developments prospects future chairman,A000109.json,Mr. ALLARD,Senate,R,2000,2000-12-05
monetary_policy,efficiency act 2000 subtitle improving monetary policy financial institution management practices sec,A000109.json,Mr. ALLARD,Senate,R,2000,2000-12-05
