Date,Speaker,Statement,Member
2005-02-02,MR. GREENSPAN,"Today is our regular annual organizational meeting and, as is customary, I will turn the floor over to Governor Ferguson.",M
2005-02-02,MR. FERGUSON,"Thank you very much, Mr. Chairman. At the first regularly scheduled Committee meeting of every year, our first obligation is to elect a Chairman and a Vice Chairman to serve until the election of their successors at the first regularly scheduled meeting of the next year. So let me now open the floor for nominations from among our members for Chairman and Vice Chairman.",M
2005-02-02,MR. GRAMLICH,I nominate Alan Greenspan to be Chairman.,M
2005-02-02,MR. FERGUSON,And do you have a nomination for Vice Chairman?,M
2005-02-02,MR. GRAMLICH,I nominate Timothy Geithner as Vice Chairman.,M
2005-02-02,MR. FERGUSON,Is there a second to those nominations?,M
2005-02-02,SEVERAL,Second.,joint
2005-02-02,MR. FERGUSON,"Any other nominations? Any objections? Any comments? Well, we’re not in an era of great democracy.  Let the record show a unanimous vote for Messrs. Greenspan and Geithner to be Chairman and Vice Chairman of the FOMC until its first regularly scheduled meeting of 2006. Congratulations.",M
2005-02-02,MR. GREENSPAN,Thank you very much. I wish to note that there was no voter fraud that I could perceive.,M
2005-02-02,MR. FERGUSON,And we have a turnout of 100 percent!,M
2005-02-02,MR. GREENSPAN,"The next item on the agenda is the selection of staff officers. Would you kindly read the list for us, please?",M
2005-02-02,MS. DANKER,"Yes. For Secretary and Economist, Vincent Reinhart; Deputy Secretary, Deborah Danker; Assistant Secretary, Michelle Smith; General Counsel, Scott Alvarez; Deputy General Counsel, Thomas Baxter; Economists, Karen Johnson and David Stockton; Associate Economists, Thomas Connors, David Howard, Brian Madigan, Steven Oliner, David Wilcox, Charles Evans, Loretta Mester, Arthur Rolnick, Harvey Rosenblum, and Joseph Tracy.",staff
2005-02-02,MR. GREENSPAN,I’ll entertain a motion for the proposed slate.,M
2005-02-02,SEVERAL,So moved.,joint
2005-02-02,MR. GREENSPAN,"Without objection, that is approved. The next item on the agenda is the selection of a Federal Reserve Bank to execute transactions for the System Open Market Account. My notes indicate to me, and I quote, “New York is the odds-on favorite.”  In that event, not wishing to go against the odds, I will entertain any motion which is restricted to nominating the Federal Reserve Bank of New York!",M
2005-02-02,MR. FERGUSON,"Well, consistent with the odds and tradition, I will nominate the Federal Reserve Bank of New York.",M
2005-02-02,MR. GREENSPAN,"The nomination is approved without objection. Since we have done that, let’s move to a decision that may be far more important, which is to select the Manager of the System Open Market Account. I understand that there’s only one name on this ballot, and it’s Dino Kos. Unless anyone has an objection, I will presume that there was a nomination, a second, and a unanimous vote in the affirmative. Hearing no objection to that, I presume that that selection is now approved. Now I’d like to call on Dino in his renewed official position.",M
2005-02-02,MR. KOS,"Thank you, Mr. Chairman. I have two subjects on which I’ll need a vote from the Committee. The first one is on the Foreign Currency Directive, the Authorization for Foreign Currency Operations, and the Procedural Instructions with Respect to Foreign Currency Operations. I recommend that they be approved with no amendments.",staff
2005-02-02,MR. GREENSPAN,"Questions? Objections? If not, they are approved.",M
2005-02-02,MR. KOS,"The second item is the Authorization for Domestic Open Market Operations, which I propose be approved with one amendment as described in the memo dated January 24, 2005. That amendment would eliminate the so-called leeway provisions—the limit on the amount by which holdings of securities in the System Open Market Account can change between meetings—given that the Committee has many other ways to oversee the activities of SOMA .",staff
2005-02-02,MR. GREENSPAN,"Any questions? Approved without objection. We have received documents on proposed revisions to the Committee’s rules, statements, and resolutions, and I presume you have read them. I need a vote to approve the proposed revisions, but, obviously, if there are comments, we will discuss them prior to that. Hearing none, they are approved without objection. Incidentally, because of the timing, we need to determine officially as a Committee that public notice and comment on these amendments would be unnecessary or contrary to the public interest. I would accept a motion to that effect.",M
2005-02-02,SPEAKER,So moved.,joint
2005-02-02,MR. GREENSPAN,"Approved without objection. We have an annual review of the Committee’s Program for the Security of FOMC Information. I’d like to emphasize a point covered on page 1, which is that individuals who have access to confidential information may provide it to or discuss it only with those Federal Reserve employees who are authorized to have access to such information. I raise these issues every year. We all vote upon these rules and agree to bind ourselves to them, and invariably we slip periodically. I trust that at some point we’ll do better than we have done, especially fairly recently. I understand that President Moskow would like to say a few words on this.",M
2005-02-02,MR. MOSKOW,"Mr. Chairman, I think the leak of the topic for today’s discussion, which was the subject of an article that appeared in The Wall Street Journal, was very disappointing and troubling. I’ve been with the Federal Reserve for10 years, and we pride ourselves on being an organization with very high integrity. When we have a leak like that, I think it’s really an embarrassment to the Federal Reserve and to each of us individually. Leaks such as this have happened on rare occasions in the period that I’ve been here. But I think it is important that we emphasize every year, in line with the integrity of this organization, how crucial it is to maintain the confidentiality of what we discuss.",M
2005-02-02,MR. GREENSPAN,"I’m at a loss to understand the motives of communicating obviously confidential information that could compromise the nature of our deliberations here. What is to be gained? I don’t get it. All I can do is to reiterate, as we vote on this, that we take it very seriously. I will assume everyone is in the affirmative on this. We will now move on to a rather large topic, price objectives for monetary policy. I’d like to call on David Wilcox, Doug Elmendorf, and Vincent Reinhart to make their presentations.",M
2005-02-02,MR. WILCOX,"Thank you, Mr. Chairman. We’ll be referring to the package of material entitled “Considerations Pertaining to the Establishment of a Specific, Numerical, Price-Related Objective for Monetary Policy.” As a prelude to your discussion this afternoon, Doug Elmendorf and I will briefly summarize some of the main points made in the R&S  staff paper that was distributed to the Committee. Then Vincent will address the issues related to communications and governance that would arise were you to define a numerical objective. As can be seen in the top panel of your first exhibit, inflation as measured by any of the major indexes has been both low and stable by historical standards for the last several years. With the economy now operating in the neighborhood of price stability, some analysts have pressed for more clarity and precision about your ultimate objectives with respect to the price-related piece of your dual mandate. Others, however, have expressed serious reservations about moving away from what they perceive to be a successful status quo. The background paper discusses the major issues the Committee would need to consider in determining whether to adopt a specific, numerical, price-related objective. We view the key characteristics of such an objective, listed in the middle panel, as the following: First, it would be numerical rather than qualitative. Second, it would be stated in terms of a particular published index. And third, it would involve a commitment to either inflation control or price-level control. To give meaning to such an objective, the Committee would presumably aim to achieve it on average over some extended period of time. As noted in the lower panel, a premise of the paper is that a price objective should be chosen to minimize the costs of deviations from price stability. If you share that premise, then you might conclude, as we did, that the objective should be defined with respect to the price index most closely related to such costs. Such an index need not be the best short-run indicator of underlying price trends. For example, an overall price index might be a better gauge of the costs incurred as a result of deviations from price stability—and therefore a better point of reference for a medium-term price objective—even though a core index might be a better real- time indicator of underlying inflation. One counterargument to this view is that a smoother measure of inflation would breach a band of any given width less frequently and so would present the Committee with fewer communications challenges. This is true enough; we would simply note that the width of any band would be a choice available to the Committee. In the paper, we underscored that we see the question of whether the Committee should adopt a specific, numerical, price-related objective as distinct from the question of whether it should adopt an inflation targeting regime. However, even the more limited step of establishing an explicit price objective presumably would involve important changes in the Federal Reserve’s relationships with the public and the Congress—issues that will be addressed by Vincent in his remarks. Your second exhibit summarizes some of the potential benefits and costs of adopting a specific, numerical price objective. On the benefits side, advocates believe that publicly announcing such an explicit price goal could help preserve the present commitment to price stability by raising an impediment to backsliding on the part of some future FOMC. Second, announcing an explicit price objective could better anchor long-run inflation expectations. In turn, better-anchored expectations about future inflation might reduce the volatility of current inflation through its effect on price-setting and might reduce the volatility of real activity by giving the Federal Reserve greater scope to offset shocks. Third, a specific objective could improve public understanding of monetary policy, as the Committee took yet another step to increase the transparency of the policy process. And lastly, agreeing on an explicit price objective could help focus policy debates within the FOMC by ensuring that everyone is aiming to accomplish a common objective. All that said, skeptics of a specific, numerical price objective argue that the burden of proof should be on those who would disturb the status quo, and they see several sources of potential harm. For one thing, if the Committee meant to preserve the current balance of emphasis between price stabilization and activity stabilization, then adopting an explicit objective for prices—but not for unemployment or output—might mislead the public into believing that your emphasis had shifted toward the price objective. Second, pursuing such a course could, in fact, cause the Committee inadvertently to place more emphasis on the price objective. A third potential cost could arise if your credibility were seen to be diminished when inflation differed from the stated objective. Finally, a commitment to an explicit price objective could constrain future actions of the FOMC in an unhelpful manner. For example, the Committee might feel inhibited in responding as aggressively as it would like to a financial crisis if inflation were already to the high side of the Committee's objective. Unfortunately, empirical evidence on these potential costs and benefits is quite limited, as summarized in the bottom panel. Little to no evidence exists regarding the likely influence of a specific price objective on FOMC decisionmaking or the quality of communications with the public. Evidence is also limited on whether an explicit price objective would improve macroeconomic performance. As documented in the background paper from the Division of International Finance and noted in the second bullet, there are some hints from the foreign experience that specific price objectives have helped anchor long-term inflation expectations. However, survey-based expectations measures have been quite stable in the United States of late, so expectational gains from adopting a specific price objective are not guaranteed and probably would be modest if they did occur. Moreover, the foreign experience does not speak clearly as to whether better-anchored expectations have yielded better macroeconomic performance. A key question on the empirical front is whether an explicit price objective would change the way that private agents form their expectations. Insight into this question might be gained by investigating whether the profound change in the conduct of monetary policy over time in the United States has induced changes in the formation of inflation expectations. Unfortunately, the evidence on this point is disputed, as noted in the third bullet: Some analysts attribute the reduced volatility of inflation and real output in recent decades to the changes in monetary policy, but other analysts point to different factors. Faced with such limited empirical evidence, some researchers have turned to model simulations for help in gauging the possible consequences of changes in monetary policy. Simulations of the FRB/US model, among others, indicate that better-anchored inflation expectations would reduce the volatility of inflation and real output. However, this result is admittedly sensitive to the assumptions underlying the specification of these models. In summary, then, we concur with our colleagues in the International Finance Division in reading the evidence as suggesting that adoption of a numerical price objective probably would not yield either large benefits or large costs, relative to the conduct of monetary policy in recent years. Unfortunately, we also see that evidence as incapable of resolving the question of whether such a step would generate net benefits or costs on a more modest scale. That leaves us believing that the most relevant and important issues for the Committee to discuss may be ones that only you can adequately assess: On the plus side, the extent to which an explicit objective may aid your internal dynamics by ensuring that everyone is pulling toward a common objective and may facilitate your communication with financial markets, and, on the minus side, the extent to which such an objective may skew the priorities you assign to the two legs of your mandate.",staff
2005-02-02,MR. ELMENDORF,"If the Committee chose to specify a numerical price- related objective, it would need to resolve a number of operational issues—the subject of your next exhibit. The top left panel of the exhibit presents a checklist of these issues. The first item is the choice of a price index. We favor consumer prices on several grounds shown in the top right panel. On the practical front, indexes of consumer prices are probably the most familiar to the public and the best measured. From a theoretical perspective, the costs of inflation relate to many different sorts of prices. But because inflation rates generally move together in the long run, anchoring some measure of consumer price inflation would, for the most part, pin down other broad measures of inflation as well. The second item on the checklist is the choice between inflation control, where “bygones are bygones” with respect to inflation surprises, and price-level control, where such surprises are eventually offset. I will not review the pros and cons of these approaches here, but simply repeat our conclusion in the paper that, if the Committee were to go down this road, an inflation-based strategy probably makes the most sense at this point. The chief factors bearing on the third decision on the checklist—the average inflation rate—are highlighted in the middle panel. One consideration is measurement bias: The Board’s staff estimates that the CPI overstates changes in the cost of living nearly 1 percentage point per year and that the change in PCE  prices is biased upward about ½ percentage point per year. In framing your objective in terms of a published index, you will want to take this bias into account. Turning to true inflation, the rationales for aiming for zero are simply the traditional costs of inflation, including money illusion, relative-price confusion, and imperfect indexation of the tax code. The chief rationales for positive true inflation are downward nominal wage rigidity and the zero lower bound on nominal interest rates. Analyses of microeconomic wage data suggest that individuals have a special distaste for nominal wage cuts, raising the possibility that lower inflation could lead to a higher equilibrium rate of unemployment. Yet, such downward rigidity has left little imprint on macroeconomic outcomes, at least so far, as low inflation over the past 15 years has not been associated with elevated unemployment. However, this phenomenon might matter more in the future if productivity growth slows or inflation moves even lower, because either of those developments would push a larger share of equilibrium nominal wage changes below zero. Another cost of very low inflation is that the equilibrium nominal interest rate could decline to a level that would limit the Committee’s scope for cutting rates. The table in the bottom panel presents illustrative estimates of the effect of the zero bound based on stochastic simulations of the FRB/US model. For these estimates, we assume that monetary policy follows an updated Taylor rule with a larger coefficient on the output gap that better matches the responsiveness of the funds rate to output movements since the late 1980s. If, as shown in the rightmost column, the bias-adjusted inflation objective is 2 percent, the funds rate equals zero just 6 percent of the time, and the standard deviation of the output gap is 2.2 percentage points. As the inflation objective falls, the funds rate is constrained at zero an increasing percentage of the time, causing economic performance to deteriorate at an increasing rate. For example, with a bias- adjusted objective of zero—in the left column—the funds rate is pinned at zero 16 percent of the time, and the standard deviation of the output gap rises to 2.5 percentage points. To be sure, there are alternative ways to implement monetary policy if the funds rate becomes stuck at zero. But these alternatives are much less familiar than traditional policy actions and therefore less predictable in their effects. To sum up our analysis of the optimal long-run inflation rate, we read the admittedly scant evidence as suggesting that a cushion of 1 percentage point on true inflation would provide sufficient insurance against the costs associated with the zero lower bound and downward nominal wage rigidity without imposing a high cost through the other effects of inflation. However, the results from the literature are not so precise as to rule out other figures in the neighborhood of 1 percent as representing a sensible balance between these competing considerations. The last item on the checklist is the choice between a point objective and a range. One virtue of a point objective would be its simplicity; there could be little confusion about where the Committee preferred the inflation rate ultimately to be heading. On the other hand, the Committee might prefer a range for several reasons: to communicate the variability of inflation, to allow for uncertainty about the appropriate numerical value, to encompass divergent views among Committee members, or to express a “zone of indifference” about the inflation rate. As we note in the paper, the economic consequences of announcing a range rather than a point objective would depend on why the Committee chose a range and how it explained that range to the public. Your fourth exhibit considers the accuracy with which the FOMC could achieve an inflation objective. Because inflation is volatile and because monetary policy influences it only indirectly and with a lag, the Committee could not hit a point objective precisely or guarantee to keep inflation within a narrow range. To assess the likely accuracy with which inflation could be controlled, we use stochastic simulations of the FRB/US model. The table in the middle panel shows results for a variety of alternative assumptions. The first row uses the shocks that are estimated to have occurred between 1968 and 2004. Under these conditions, total PCE inflation averaged over four quarters could be held within plus or minus 1 percentage point of the desired rate 59 percent of the time, and core PCE inflation could be held in the same interval 64 percent of the time. If the volatility of economic shocks were lower—in line with the 1984 to 2004 experience—the Committee would be able to control inflation somewhat more precisely, as shown in the second row. Indeed, total PCE inflation on a four-quarter basis has been within 1 percentage point of its average level almost 70 percent of the time since the mid-1980s and nearly all of the time since the mid 1990s. A key uncertainty about the inflation process, and thus an important risk to these figures, is the nature of expectations formation. The first two rows of the table assume that expectations follow a simple vector autoregression  in which the public’s long-run forecast of inflation responds gradually to actual inflation and is not influenced by FOMC announcements. Row 3 just repeats the results from row 2, with the label emphasizing that expectations are VAR-based with imperfect credibility surrounding any announcement of a long-run inflation objective. In row 4, we continue to assume that near-term expectations are formed using a VAR, but we assume that long-term expectations are perfectly pinned down by the FOMC’s announced objective. In this case, four-quarter total PCE inflation stays within a 1 percentage point band 80 percent of the time. The Committee could tighten its control of inflation, relative to the results discussed so far, by responding more aggressively to movements in inflation and output. However, as shown in the paper, this effect is fairly small. All told, as noted in the bottom panel, the Committee could likely keep four-quarter total PCE inflation within a plus or minus 1 percentage point band about two-thirds to three-quarters of the time.",staff
