Date,Speaker,Statement,Member
2005-02-02,MS. MINEHAN,"I have one further question. I’ve been surprised to read in some of the market publications—the newsletters from J.P. Morgan and so forth—that a number of market participants appear to be getting more convinced, based on their reading of the political tea leaves, that a move on the Chinese currency is going to occur sooner rather than later. Have we thought about the implications for this forecast if something like that happens?",M
2005-02-02,MS. JOHNSON,"We haven’t taken the step of, say, putting that into an alternative simulation in the Greenbook, which maybe we should do. But we have been thinking about the issue and what alternatives might be good—that is, effective and productive—and what alternatives might be counterproductive. There was a time about three weeks ago when the amount of chatter about the Chinese regime was very elevated. And there were some remarks that came out of the meetings in Davos, just five days ago, that made it seem as if something was imminent. And then the talk would subside and it would go quiet. Do I think that nothing is going to happen in this regard between now and the end of 2006? Personally, my answer would be “No, I don’t.” I think something will happen before that. But we would have a very hard time specifying exactly what will be done or when and putting it in the baseline forecast.",staff
2005-02-02,MS. MINEHAN,Do you have a bigger-than-a-bread-box feeling about how that will work?,M
2005-02-02,MS. JOHNSON,"I could make it bigger than a bread box, depending on whether the rest of Asia reacts in some explicit manner. I say that because the pegging to the dollar is a device for stabilizing exchange rates among the Asian trading partners. So if China moves in certain ways, that might trigger a reaction on the part of its trading partners. But I could imagine some steps that China might take that wouldn’t do that. Now, I think we can, and probably should, take a chance and commit to writing what we think those relationships are and what the implications might be. If all of the Asian currencies move, I think you would see some consequences. If China revalues by 5 percent and pegs again and nobody else does anything, I think it will be almost inconsequential. It will be politically helpful to a variety of people, but economically I don’t believe it will mean a lot. If China not only moves but also floats—if it defines a band in which the currency will fluctuate or goes to a weighted average or, in other words, introduces the potential of movement going forward—and that triggers a comparable decision on the part of other Asian countries, it’s a different story. If the currencies of Asian countries that now in one way or another stabilize their exchange rates with China’s become more flexible vis-à-vis their bilateral rate with the dollar, I think the implications could be greater.",staff
2005-02-02,MS. MINEHAN,Thank you.,M
2005-02-02,MS. JOHNSON,I guess I will commit to trying to do some sort of analysis of this issue or an alternative simulation in the next Greenbook. I think that would be a helpful thing to do.,staff
2005-02-02,MS. MINEHAN,Maybe not on my say-so alone.,M
2005-02-02,MR. GREENSPAN,Governor Gramlich.,M
2005-02-02,MR. GRAMLICH,"Just as a derivative question, relating to chart 13, Karen. You were commenting on the disappointing performance of exports, and one of your stories was the rather sharp downturn in exports to “Other Asia.” Could you elaborate on that a little bit? Is that, in your view, importantly or unimportantly affected by the Chinese peg to the dollar?",M
2005-02-02,MS. JOHNSON,"I don’t know that I would link it to that particularly. I think it is in part, but I can’t tell you how much, a result of the integration of trade—or reintegration of trade—that’s going on in Asia, so that exports that previously came to us from Japan now pass through China for some final stage of processing. There’s a sense in which the gains that China is making are coming at the expense of other Asian trading partners and are not of much significance. On the other hand, if the China and Hong Kong line had gone up at the same time that this “Other Asia” line went down, I think I would have had to say that I shouldn’t show them separately but should add them together or something. But it did not. I’d point more to the high-tech sector as a factor. In terms of the risks to this global forecast, we have oil prices, our basic standard risk. But the issue of whether the high-tech sector is going through a temporary inventory lull and is going to rebound or not is the biggest question mark for the Asian emerging-market countries. I think that accounts for the falloff in trade at the end of last year—that is, the falloff in exports more broadly and in IP . I think that’s all wrapped up in the high-tech question.",staff
2005-02-02,MR. GREENSPAN,Governor Bernanke.,M
2005-02-02,MR. BERNANKE,Does your simulation of the effect of the 10 percent decline in the dollar include the effects on foreign countries’ income from facing a more appreciated exchange rate?,M
2005-02-02,MS. JOHNSON,"Yes, we did that in our global model. And those countries—given that prices in their currency for the goods they sell to the United States go up because the dollar is depreciating—actually earn some income, which is then spent on U.S. exports. So in that sense it accounts for all the money that is spent on trade. It goes somewhere; it feeds back to the model.",staff
2005-02-02,MR. BERNANKE,It also affects their import demands.,M
2005-02-02,MS. JOHNSON,"Yes, that’s what I’m saying.",staff
2005-02-02,MR. BERNANKE,That’s from the income effects.,M
2005-02-02,MS. JOHNSON,"Yes. Now, the model has the usual Houthakker and Magee asymmetry in it, but the move down of the dollar is very stimulative. In our model it would be a very stimulative shock to the United States, and it would be a contractionary shock to almost all of our trading partners.",staff
2005-02-02,MR. BERNANKE,"The reason I ask is because your simulation raises the question of whether the derivative is the right sign on the current account with respect to the dollar. Given the effect that the falling dollar has on our interest rates and, therefore, on our capital income payments, there seems to be so very little effect on the current account from the weakening dollar.",M
2005-02-02,MS. JOHNSON,"Right, but because of the interest rate effect. Now, it’s possible that the model doesn’t fully capture valuation effects. In the direct investment account, the fact that the dollar is depreciating means that every euro earned by a U.S. subsidiary is now worth more dollars rather than the same number of dollars. So this current account effect may be too conservative. It’s possible that the current account would improve more via that valuation effect than the model is fully able to capture.",staff
2005-02-02,MR. GREENSPAN,Why can’t you capture it? It seems like a straightforward—,M
2005-02-02,MS. JOHNSON,"Well, our people do their best, but the financial flow part of the model is less fully articulated than is the real side of the model.",staff
2005-02-02,MR. GREENSPAN,It’s not that you don’t have the data. You do.,M
2005-02-02,MS. JOHNSON,Yes. It’s just a question of how many equations—or how many independent variables—you can actually manage.,staff
2005-02-02,MR. GREENSPAN,"Any further questions for our colleagues? If not, who would like to start the Committee discussion? President Moskow.",M
2005-02-02,MR. MOSKOW,"Thank you, Mr. Chairman. The story from the Seventh District is much the same as last time. We’re seeing a broad-based improvement in business conditions. I would characterize it as solid growth, but not spectacular. Most of the sectors that were strong last year continue to do very well and expect good results for 2005. These include steel, heavy trucks, construction machinery, and commercial printing. A number of firms in these industries have been able to raise prices without seeing a reduction in their order backlogs. We’ve also heard some upbeat forward-looking reports on commercial aircraft. And agriculture has been very strong. Farm incomes were up sharply last year, and that has been supporting big gains in the sale of agricultural equipment. We also saw the largest annual increase in District farmland values in 15 years. On the other hand, the outlook for the Big Three automakers, whose operations and those of their suppliers are heavily concentrated in our District, is not so good. Most analysts expect light vehicle sales to be similar to last year, but the Big Three are concerned about losing even more market share. And their profit outlook is not good; we continue to hear that they have significant cost disadvantages relative to the transplants. Moreover, foreign nameplates have built out their product lines to the point where the Big Three face stiff competition in just about every market segment. One result of the relatively poor performance of the Big Three is that Michigan now has the highest unemployment rate in the nation.",M
2005-02-02,MR. GRAMLICH,You got to be first in something!,M
2005-02-02,MR. MOSKOW,"Actually, Illinois is leading the Big Ten in basketball.  They are undefeated so far. On the price front, there’s more talk that higher costs for plastics and other energy-related inputs are working their way downstream, but we’re certainly not hearing widespread reports of major price increases. With regard to labor markets, the two large temporary staffing firms that we speak with regularly continue to report roughly 10 percent overall growth relative to a year ago, with demand for skilled workers rising fastest. Like us, they have been expecting a period of more robust employment growth. But the further we get from the recession, the more they are becoming resigned to the idea that the growth rates we’ve seen over the last year may be as high as we’ll get in this cycle. The president of one of the temp firms made an interesting observation about the reluctance of businesses to hire. He said: “Everybody still has a reason to be cautious, but lately the reasons are industry-specific.” This is an improvement from a year or so ago when many firms reported being worried about the strength of the overall economy. His observations pretty much match my impressions. Things aren’t exactly roaring, but few businesses regard the expansion as fragile. Turning to the national outlook, once again the data we’ve received since the last meeting have not materially changed our outlook for 2005. We continue to expect that output will expand at a rate somewhat above potential and that there will be little change in core inflation. I think the alternative simulations in the Greenbook did a good job of laying out a number of the risks to the forecast. Overall, I think these risks are balanced. The “higher long-term interest rates” simulation did give me some pause, especially because of the talk that foreign investors may be revising their thinking about U.S. securities. But I remain concerned about another risk that we talked about last time, namely, that, instead of some appreciable slack remaining in the economy, we may already be essentially at potential or approaching potential. This view was raised by some of the participants, albeit a minority, in the meeting we had last week of our academic advisors and Chicago-area business economists. When asked about the course of policy going forward, there was a roughly even split between those who thought that the path implicit in futures markets was about right and those who thought we should be raising rates at a faster pace. My own view is that we will probably have to raise rates this year to levels that are higher than those expected by futures markets. As we all know, we will face communication challenges as the year proceeds. It’s probably not critical today, but it will become more so as we move through the year.",M
2005-02-02,MR. GREENSPAN,President Yellen.,M
2005-02-02,MS. YELLEN,"Thank you, Mr. Chairman. The Twelfth District economy continues to expand, posting growth in line with that of the nation. Consumer spending remains strong, led by gains in travel, services, retail goods, and especially housing. Businesses have also been spending, and our contacts expect to increase investment in coming months. The weaker dollar continues to benefit District exporters who report booming demand for their products. Although international trade volumes remain high, increased hiring and around-the- clock work schedules have cleared out the backlog of ships at our ports. Some bottlenecks remain in the ground transportation networks as a result of storms, mudslides, and infrastructure problems but these, too, are waning. Turning to the national economy, recent economic data have been encouraging, raising my confidence that the expansion has found a secure footing. The December employment report was by no means spectacular, but it strengthened the impression that the labor market has firmly established a pattern of moderate improvement. In terms of the outlook for the real economy, I’m generally in agreement with the Greenbook. But I think it’s important to emphasize that this forecast, which calls for growth only moderately above potential with a very gradual diminution of the remaining labor market slack, depends on a very gradual pace of monetary tightening. The Greenbook incorporates only three more 25 basis point increases in the funds rate this year. Moreover, even with this modest tightening, I consider the Greenbook optimistic in expecting longer-term interest rates to remain at their present levels. In my judgment, the risk with respect to longer-term yields is asymmetric. Should longer-term yields increase, growth could fall well short of the Greenbook projection, as shown in an alternative simulation. Turning to inflation, the data received since our December meeting, particularly the CPI and the ECI, have been favorable. The forecast for a rise of about 1½ percent in the core PCE price index in 2005 strikes me as very reasonable. We’re all aware of the sources of risk in this outlook, including the future paths of the dollar and oil prices, the currently high markup of prices over unit labor costs, trend productivity growth, and, of course, the degree of slack left in the economy. In December I argued that the risks to inflation from productivity developments were reasonably well balanced. I hold roughly the same view on the risks emanating from labor market slack and would like to focus the remainder of my comments on this issue. A considerable body of research—most conducted within the Federal Reserve System—has examined the possibility that the last recession and recovery were characterized by unusually large structural shifts, resulting in an exceptional degree of mismatch in the labor market. If an unusually small fraction of the currently unemployed are qualified for existing or emerging job vacancies, the true degree of slack in the labor market is overstated by measured unemployment. In effect, the NAIRU has risen. This possibility motivates one of the alternative simulations in the Greenbook. At the AEA  meetings in Philadelphia last month, I chaired a session in which four teams of Fed economists subjected this structural-shifts hypothesis to close scrutiny. I emerged from this session a skeptic. I see this recent research as casting considerable doubt on the hypothesis that the jobless recovery was a period of pronounced economic restructuring. In fact, the consensus of the session was that sectoral reallocation has probably been running at roughly normal levels for our dynamic economy. The finding of unusually large sectoral shifts is based on the behavior of several nontraditional measures of restructuring. In contrast, such traditional measures as the dispersion in industry employment growth rates revealed the last recession and jobless recovery that followed to be a period of low, not high, sectoral reallocation. The problem with traditional measures is that they may confound cyclical with sectoral changes. The alternative restructuring measures, however, turn out not to be robust to minor changes in the time period studied and the methodology used. One sign that mismatch is not unusually high, at least during the recovery period, comes from data on job creation and job destruction. In 2003, for example, total job reallocation—defined as the sum of job creation and destruction—stood at its lowest level in the last decade for which data are available. Another sign that mismatch is not especially high comes from the Beveridge curve relating unemployment and job vacancies. A shifting out of the Beveridge curve, signaling higher levels of vacancies coexisting with any given level of unemployment, would provide evidence of increased mismatch. Using a new measure of job vacancies that adjusts for well-known biases in help-wanted advertising, staff at our Bank, however, found no evidence of such an outward shift. If skill mismatch had intensified, we might also expect to see diverging unemployment rates and compensation paths for workers of different skills. However, analysis by our staff shows that since the onset of the recession, the unemployment paths of less- and more-educated workers have been similar, and the change in compensation growth for lower-skilled occupations has been at least as rapid as for occupations requiring higher skills. These findings align with reports from our contacts who tell us that for the most part they’re able to hire workers at all skill levels. Even in markets where workers are harder to find, our contacts report little difference in hiring difficulty or compensation growth by skill. With respect to the introduction of labor-saving technologies, our sense is that such innovations are affecting the entire skill distribution. For example, reports from two of our contacts, a lawyer and a farmer, illustrate this point. We were told that the law firm had replaced skilled legal workers with software designed to search for criminal evidence in e-mail files. The farm introduced machinery that reduced the number of field workers needed to harvest row crops from 400 to 40. So, my bottom line is that I do not think the evidence supports the case that NAIRU has increased due to an unusual degree of mismatch in the job market. Turning finally to policy, I think it makes sense to remove a bit more accommodation at this meeting, but I do think we’re reaching a point where relatively soon we will need to begin to slow this process down.",M
2005-02-02,MR. GREENSPAN,President Santomero.,M
2005-02-02,MR. SANTOMERO,"Thank you, Mr. Chairman. Economic activity in the Third District continues to expand at a moderate pace, but there is some variation across the three states of our District. Leading indicators are signaling continued solid growth in New Jersey and Delaware but more modest growth in Pennsylvania. Payroll employment in our states grew at a 1¼ percent pace in the fourth quarter of last year, down from an unsustainably strong pace earlier in the year. Pennsylvania continues to have the slowest job growth and the highest unemployment rate among the three states in our District. Our business outlook survey indicated a considerably slower pace of expansion in regional manufacturing in January. The general activities, new orders, and shipment indexes all fell to their lowest levels in 18 months. This is something to watch. The deterioration is not just localized in Philadelphia. I note that New York’s manufacturing survey also weakened in January. At the same time, it’s important to remember that these are just one-month readings, and other indicators in the January survey are less negative. For example, current and future employment indexes in our survey are near their highest levels in the current expansion. Turning to future capital spending in the District, we participated, as did the other Districts, in the Board staff’s survey. Our results are quite similar to the results for the nation as reported in Larry Slifman’s memo. On a related topic, all of these results—in addition to the comments from firms in our District over the past several months—suggest that the expiration of the partial- expensing provisions had a smaller impact on firms than is assumed in the baseline Greenbook forecast. Turning to our economic intelligence on other sectors, there appears to be little change. Consumers continue to spend at a moderate pace. Holiday sales in the region generally met expectations for a good, if not spectacular, showing. As was true in the nation, sales of luxury items showed the strongest performance, with year-over-year current dollar gains greater than 10 percent. Most of the other retailers reported year-over-year increases of around 3 percent. As I reported last month, nonresidential construction in our region remains soft. The office vacancy rate in the Philadelphia metropolitan region has remained at about 16.5 percent since the end of 2003, although we are seeing some net absorption over the past year. The construction of two new office towers will increase available space significantly, by about 5 percent. Meanwhile, residential construction has remained healthy, but it is down from its peak. House appreciation continues, especially on the New Jersey shore, where prices were up over 20 percent in the past year. In summary, the economic expansion continues at a moderate pace in the Third District, and the outlook among business contacts in our region remains positive. My outlook for the nation is similar to that of the Greenbook, with real growth averaging about 3¾ percent over the next two years. Like the Greenbook, we expect consumer spending to expand at about that pace as well. This consumption forecast reflects our view that the current personal saving rate, despite its low level, is not likely to lead to a reduction in household spending. As we all know and as was mentioned here today, the personal saving rate averaged 1 percent last year. That compares to an average since 1959 of over 7 percent. There has been some concern expressed that consumers will hold back on their spending as we withdraw monetary stimulus, but a Philadelphia staff analysis casts considerable doubt on this outcome. That study points out several factors that warrant our attention. First, measured personal saving excludes some investments, such as investment in human capital and capital gains, therefore underestimating the true saving rate. Second, our real-time data series show that personal saving rates have been revised upward systematically, tending to wipe out low measured saving rates in the past. Since 1965, the mean revision has been about 2½ percentage points. Third, the permanent income hypothesis suggests that a low saving rate may signal expectations of faster future growth in labor income. Moreover, there is no significant empirical evidence that a low saving rate forecasts slower consumption growth. While our forecasts are similar to the Greenbook’s with respect to consumer spending and total GDP, there are some key differences. As I’ve already mentioned, we expect less of an effect from the expiring tax incentives on business investment. So we see stronger growth there, and our pattern of growth is smoother than in the baseline forecast in the Greenbook. We also anticipate a large depreciation in the dollar for reasons we talked about today; that discussion was helpful to me in understanding the Greenbook forecast. Thus, real net exports do not make much of a negative or positive contribution to growth over the next year in our forecast. Our larger depreciation of the dollar, coupled with less slack than in the Greenbook baseline, leaves us to project a slow rise in core PCE inflation over the forecast horizon to 1¾ percent for 2005 and 2 percent for 2006. This contrasts with the Greenbook’s forecast of a slight deceleration in inflation. Both the Greenbook’s and our forecast are predicated on maintaining our strategy of gradually removing policy accommodation to bring policy back to a more neutral stance. Nothing in the current conditions or in the economic outlook suggests that it’s time to revise that strategy. We are at a point in the cycle where I think it is particularly important that we remain vigilant and forward-looking with respect to inflation. The recent acceleration in core CPI inflation means that it is no longer in the lower part of the acceptable range, in my view. This acceleration has not been large, and it has not yet shown up in the core PCE inflation. Nonetheless, both oil prices and the dollar pose an upside inflation risk. Thus, it seems prudent for us to remain vigilant and to continue on our upward path for the funds rate.",M
2005-02-02,MR. GREENSPAN,President Minehan.,M
